โควต้าคืออะไรเหรอ,ลงทะเบียนเรียน
เอกสารระดับบัณฑิตศึกษาคือเมื่อไหร่,ขอเอกสาร/ใบรับรอง
ฮัลโหล ฉันถามเรื่องการจ่ายเงินเมื่อปีที่แล้วแต่ยังไม่ได้หยิบมัน (หยุดแล้ว) ฉันไม่รู้ว่าฉันสามารถรับมันได้หรือยัง ฉันแนบเงินและโอนเอกสารแล้ว,ขอเอกสาร/ใบรับรอง
การถอนตัวนั้นไม่ได้เรียกเก็บเงินจากหน่วยของขวัญหรือไม่?,ลงทะเบียนเรียน
จะมีการลงทะเบียนตรงเวลาหรือไม่?,แจ้งจบ/ขึ้นทะเบียนบัณฑิต
ฉันต้องการขอคําขอลงทะเบียนช้า ๆ,ลงทะเบียนเรียน
ครูได้ส่งเกรดไปแล้วในชั้นเรียน Ruseon ในวันที่ 23 มีนาคม 1964 เธอรู้ไหมว่าผลจะอยู่ใน Fexger เมื่อไหร่เหรอ,เกรด
สวัสดีค่ะ ขอถามได้มั้ยคะ เปลี่ยนเค้กโดยเลือกเวลาถอนพิเศษพร้อมกันได้มั้ยคะ ไม่จําเป็นต้องรีโมวัลและซ่อมใหม่ค่ะ,ลงทะเบียนเรียน
ฉันจะเปลี่ยนบัตรนักเรียนยังไง,ประวัตินักศึกษา
สวัสดี ฉันต้องการขอการลาออกของมหาวิทยาลัยของฉัน กี่วันที่คุณจําเป็นต้องทราบเกี่ยวกับระยะเวลาของการทํางานของคุณที่ต้องทําก่อนธุรกิจของคุณ,สถานภาพนักศึกษา
ขอโทษนะคะ เป็นร้านสาขาสําหรับการลงทะเบียนเรียนภาษาอื่น ๆ จากภาษาอังกฤษนะคะ แต่ยังไงก็เลือกคลาสมาสเตอร์ญี่ปุ่นแล้วค่ะ เป็นไปได้มั้ยคะ,ลงทะเบียนเรียน
เรื่องการขอปริญญาที่เสื่อมโทรม,ขอเอกสาร/ใบรับรอง
ฉันขอเงื่อนไขของนักเรียนได้ไหม,สถานภาพนักศึกษา
คุณคะ ฉันรอหนังสือไม่ไหวแล้วค่ะ,ชำระเงิน/ใบเสร็จรับเงิน
แล้วก็ขอสมัครนัดหมายภายในวันที่ 21 พฤษภาคมด้วยค่ะ ขอโทษที่ช้านะคะ,ขอเอกสาร/ใบรับรอง
คุณต้องการจะเพิ่มวันไหนในการถอน W ลงในเทอมนี้,ลงทะเบียนเรียน
จ้ะ พี่รู้ว่าจะต้องมาส่ง แต่พี่อยากได้เอกสารพร้อมตราประทับบนซองจริง ๆ น้องจะว่างที่เคาท์เตอร์วันไหน,ขอเอกสาร/ใบรับรอง
มาจากวันที่ 4,ลงทะเบียนเรียน
แล้วจะแจ้งราคาในเดือนไหนคะ,แจ้งจบ/ขึ้นทะเบียนบัณฑิต
พรุ่งนี้ผมจะจองคอร์สฟรีพรุ่งนี้นะ ผมอยากจะรู้ว่าปีที่ 1 เทอมมีเรียนด้วยเห็บสีเขียว ต้องใช้โควต้า ถ้าเหลือ ผมขอโควต้าไม่ได้,ลงทะเบียนเรียน
คําถามของแรนกิงนานาชาติ (เกรด),เกรด
มี 3-4 อื่น ๆ ที่ควรสังเกต,ลงทะเบียนเรียน
ฉันอยากรู้ว่าคําสั่งของใบบันทึกเสียง,ขอเอกสาร/ใบรับรอง
โรงเรียนขอให้ฉันส่งเอกสาร,ขอเอกสาร/ใบรับรอง
เป็นนักเรียนในโปรแกรม FRONTIER SCHOOL ของ THAMASAT ฉันพยายามลงทะเบียน TU102 หลังจากฉันเข้าไปแล้วฉันอยากรู้ว่า TU102 จะช่วยให้คุณลงทะเบียนในช่วงเวลาพิเศษของการถอนหรือไม่ หากยังไม่ได้เปิดฉันต้องติดต่อคุณสําหรับการลงทะเบียน,ลงทะเบียนเรียน
ฉันมีหมายเลขแผ่นบัณฑิตของคุณแล้ว,แจ้งจบ/ขึ้นทะเบียนบัณฑิต
มีการจดทะเบียนการลงทะเบียนตั้งแต่เดือนสิงหาคมสําหรับแต่ละคนและ 60 คนสุดท้าย,แจ้งจบ/ขึ้นทะเบียนบัณฑิต
ถ้าจะกินวันอังคารที่ 122 และอีซี210 นะคะ ให้ช่วยอะไรมั้ยคะ,ลงทะเบียนเรียน
อืม พนักงานของทีมบอกว่างานช้า ต้องหาห้องเรียนหรือต้องพักสักหน่อย,แจ้งจบ/ขึ้นทะเบียนบัณฑิต
ผลที่ได้นั้นโน้มน้าวแล้ว แต่ไม่สามารถเพิ่มเข้าไปในการถอนได้ในวันนี้,ลงทะเบียนเรียน
ฉันสามารถเพิกถอนหัวเรื่องได้กี่ครั้ง,ลงทะเบียนเรียน
สถานะยังไม่ขึ้นกับทะเบียนค่ะ ต้องทําอะไรคะ,แจ้งจบ/ขึ้นทะเบียนบัณฑิต
อยากกรอปส์โบกส์หน่อยค่ะ,ชำระเงิน/ใบเสร็จรับเงิน
ประมาณหนึ่งสัปดาห์แล้วที่ฉันทําเสร็จแล้ว แต่ฉันยังไม่ได้ใช้ระบบของฉัน,แจ้งจบ/ขึ้นทะเบียนบัณฑิต
การลงทะเบียนเว็บห่วยอ่ะ ฉันเข้าไปไม่ได้ตอน 9 โมงเช้า ฉันไม่คิดว่าฉันจะปรับปรุงอะไรไหมอ่ะ,ลงทะเบียนเรียน
สถาบันภาษาบอกว่าฉันมีรายชื่ออยู่แล้วในการตรวจจับดังนั้นฉันไม่แน่ใจว่าทําไมฉันไม่สามารถลงได้เมื่อคุณไปลงทะเบียนเนื่องจาก Cowa เต็มแล้ว,ลงทะเบียนเรียน
ให้ฉันถามเธอนะ ที่สตอร์สในฤดูร้อนนี้ มันเป็นเพียงหลักสูตรในปี 2013 และ 2020 ฉันเป็นนักเรียนด้านศิลปะและศิลปะคลาสปี 2018 เธอช่วยเรียนวิชาได้ไหม,ลงทะเบียนเรียน
คุณอยู่ในรหัส 60 นะคะ แล้วจะพร้อมให้จองเมื่อไหร่คะ,ขอเอกสาร/ใบรับรอง
ฉันสามารถลงทะเบียนกับใบขับขี่ระดับบัณฑิตศึกษาของฉันได้เมื่อใด,แจ้งจบ/ขึ้นทะเบียนบัณฑิต
ชําระเงินเรียบร้อยแล้วและสถานะก็อยู่ในการชําระเงินของฉันแล้ว เร็วมาก ขอบคุณมาก,ชำระเงิน/ใบเสร็จรับเงิน
ฉันจะลงทะเบียนวิชาอื่น มันบอกว่าฉันไม่ได้ผ่านคอร์สคํานวณ ซึ่งรอเขาทําโอน ฉันไม่สามารถลงทะเบียนได้ เธอทําอะไรอยู่เหรอ,ลงทะเบียนเรียน
เหมือนกับบิลจ่าย,ชำระเงิน/ใบเสร็จรับเงิน
โปรดขอคําปรึกษาเนื่องจากคุณต้องการขอทุนการศึกษาที่ดีของสหกรณ์ CU ซึ่งมักจะขอออนไลน์เสียเงิน 50 บาท แต่ในปัจจุบัน MTH ให้รุ่นอิเล็กทรอนิกส์ซึ่งไม่เข้าใจและฉันคิดว่าคุณสามารถทําเกรดของคุณเอง ดังนั้นผู้ปกครองบอกว่าพวกเขาต้องการปัญหาจริงเท่านั้นหรือไม่,ขอเอกสาร/ใบรับรอง
เอกสารที่ฉันขอทางออนไลน์จะส่งไปให้ทางไปรษณีย์ใช่มั้ยคะ,ขอเอกสาร/ใบรับรอง
ฉันได้ร้องขอให้คําปรึกษาด้านบริการนักเรียนผู้พิการแล้ว แต่เจ้าหน้าที่บอกว่าพวกเขาไม่สามารถติดต่อสํานักงานทะเบียนเพื่อขอลงทะเบียนได้,ลงทะเบียนเรียน
ถ้ามันไม่ใช่พลเมืองไทยจะมีภาคการศึกษาเพิ่มเติมหรือไม่ เพราะฉันไม่ชอบเพื่อนของฉัน,ชำระเงิน/ใบเสร็จรับเงิน
แต่ฉันต้องการใช้เอกสารในแอปพลิเคชันของฉัน,ขอเอกสาร/ใบรับรอง
สวัสดี เธออยากจะขอนก 24 ตัวเพื่อตัวเลือกฟรี / ยุติธรรม ใน 8 วิชาต้องอยู่ภายใต้รหัสไม่เกิน 4 รหัสหรือโดยทั่วไปไม่เกิน 4 ทีม (เช่น) กรมศิลปศาสตร์คือ PY / GE / HS),ลงทะเบียนเรียน
จากทินอฟฟี่ดั้งเดิมที่จีเมล ดอท คอม ไปที่ซุปเปอร์อัคจิระ มาเอท โดม ทียู ดูแลตัวเองละ แอ็ค,ประวัตินักศึกษา
ลงตัวพอดีกับการขึ้นทะเบียนไม่มีปุ่มลงทะเบียน,ลงทะเบียนเรียน
แต่อันนี้เพิ่งจะปิดเร็วในตอนเช้าไม่ได้ปิด?,ชำระเงิน/ใบเสร็จรับเงิน
อยากลงทะเบียนเป็นช่วงไหนของซัมเมอร์คะ,ลงทะเบียนเรียน
ขอถามก่อนนะคะ ฉันได้กรอกส่วนการบังคับใช้กฎหมายแล้ว (4/2020) คุณต้องการทราบมั้ยคะว่าคุณต้องการลงทะเบียนจากโรงเรียนบัณฑิตของคุณวันไหนคะ?,แจ้งจบ/ขึ้นทะเบียนบัณฑิต
สวัสดีจ้ะ พี่อยากรู้ว่าจ่ายที่ไหนได้บ้าง,ชำระเงิน/ใบเสร็จรับเงิน
ฉันคิดว่าฉันลงเรียนพิเศษในวันอาทิตย์ที่ 8 แต่ตอนนี้ถึงเวลาเรียนและฉันยังไม่ได้รับอีเมลของฉัน ฉันยังไม่ได้ถูกดึงเข้าเรียน,ลงทะเบียนเรียน
แสดงว่า คนลงทะเบียนเรียนวันที่ 1/2564 ได้ลดลงนับตั้งแต่วันที่ 12 ตุลาคม ดังนั้นคุณจะถูกหักออกเป็นภาคการศึกษาหรือไม่,ลงทะเบียนเรียน
คุณสามารถนับจํานวนหน่วยของขวัญบน CE หรือ CL ได้หรือไม่,ลงทะเบียนเรียน
ฉันอยากจะขอหนังสือรับประกันจบค่ะ,ขอเอกสาร/ใบรับรอง
ฉันต้องการขอเอกสารที่เป็นทางการเกี่ยวกับชั้นเรียนนี้ในภาษาอังกฤษ,ขอเอกสาร/ใบรับรอง
ฉันอยากจะถามพวกเขาเรื่องบันทึกการส่งเพื่อดูว่าพวกเขาสามารถส่งถึงที่ทําการไปรษณีย์ได้ไหม,ขอเอกสาร/ใบรับรอง
สวัสดีค่ะ อยากทราบว่าร้านเดอะสโตนเปิดในฤดูร้อน (ฤดูร้อน)/2020 มั้ยคะ,ลงทะเบียนเรียน
ถ้าคุณต้องการภายในวันนี้ คุณต้องการรับวันนี้เลยมั้ยคะ?,ขอเอกสาร/ใบรับรอง
จ่าย การศึกษา ยังไง,ชำระเงิน/ใบเสร็จรับเงิน
คุณวุฒิอยู่ที่ไหน,ขอเอกสาร/ใบรับรอง
แล้วเทอมละ บางคนเพิ่มขึ้น 1800 คนและบางคนก็8800,ชำระเงิน/ใบเสร็จรับเงิน
60. วันไหนคือหมายเลขทะเบียนบัณฑิต,แจ้งจบ/ขึ้นทะเบียนบัณฑิต
จากสาขานี้ คุณช่วยบอกได้มั้ยคะว่าต้องใช้เวลากี่วัน? ฉันสงสัยว่าเอกสารออนไลน์และการจัดส่งจะนานแค่ไหน แต่ละทางจะใช้เวลาเท่าไหร่ถึงจะได้แน่ใจว่าฉันจะได้ข้อมูลอีกครั้งทางออนไลน์?,ขอเอกสาร/ใบรับรอง
แพทย์จะต้องยื่นเอกสารเพราะพวกเขาจําเป็นต้องเริ่มทํางานในวันที่ 1 มิถุนายน,ขอเอกสาร/ใบรับรอง
ขอถามก่อนนะคะว่า วันที่ 2/2564 เปิดให้โควต้าได้ทุกเวลามั้ย มันไร้สาระมาก,ลงทะเบียนเรียน
เด็ก ๆ ค่ะ อยากได้ตั๋วเกรดเดียวกันไหมคะ,ขอเอกสาร/ใบรับรอง
ไง ฉันกําลังจะแลกเปลี่ยนและพื้นที่มหาวิทยาลัยฉันจะต้องการนําเสนอในห้องลงทะเบียนเรียนชั้นปัจจุบันของฉันรายชื่อของสิ่งที่ฉันลงเรียนภาคการศึกษานี้เพราะฉันไม่ได้อยู่ในห้องเรียน. ฉันขอเอกสารได้ที่ไหนอ่ะ,ขอเอกสาร/ใบรับรอง
สวัสดี ฉันอยากจะแก้ไขที่อยู่นี้ในรายการเรียนจบการศึกษาของฉันหน่อย ฉันอยู่ที่ที่อยู่ผิด,แจ้งจบ/ขึ้นทะเบียนบัณฑิต
ฉันควรขอเอกสารในพื้นที่อิเล็กทรอนิกส์วันไหน,ขอเอกสาร/ใบรับรอง
ฉันจะตรวจสอบได้อย่างไรว่าฉันอยู่นอกวิทยาลัย,สถานภาพนักศึกษา
การถอนเงินคืออะไร เธอเปิดกี่โมง มันผ่านไปแล้วเหรอ,เกรด
แล้วก็จะซ่อมให้เสร็จวันนี้นะคะ มีค่าใช้จ่ายเพิ่มมั้ยคะ,ชำระเงิน/ใบเสร็จรับเงิน
มันเต็มไปด้วยวิชา,ลงทะเบียนเรียน
อยากรู้ว่าจ่ายทางไหนดีคะ?,ชำระเงิน/ใบเสร็จรับเงิน
เว็บไซต์ของ Registrar ไม่สามารถพิมพ์ใบเสร็จได้,ชำระเงิน/ใบเสร็จรับเงิน
อย่างไรก็ตามหลังจากเพิ่มมันในวันนี้มีการเปลี่ยนแปลงในการทดสอบที่จะผิดพลาด,ลงทะเบียนเรียน
นั่นเป็นเวลาพิเศษหรือเปล่าคะ,ลงทะเบียนเรียน
เนื่องจากโครงการ TU100 คุณต้องการสถิติการลงทะเบียนของนักเรียนซึ่งเป็นการลงทะเบียนฟรีมากที่สุด 5 สํานักงานใดต้องติดต่อ,ลงทะเบียนเรียน
โอ้ ไม่เป็นไร ถ้าคุณสามารถรับใบรับรองสถานะของนักเรียนในสัปดาห์นั้นหรือสองสัปดาห์ คุณจะสามารถรับใบประกาศสถานะของนักเรียนได้,สถานภาพนักศึกษา
สวัสดี ถ้าเธอจะขอเงื่อนไขนักเรียน ฉันถามได้ไหม,สถานภาพนักศึกษา
ไง ถ้าเธอจะขอให้มหาวิทยาลัยอนุมัติเอกสารของเธอได้ไหม ฉันต้องส่งที่ไหนและกระบวนการคืออะไรเหรอ,ขอเอกสาร/ใบรับรอง
ฉันอยากขอค่าธรรมเนียมเซมสเตอร์ในยูยูเอค่ะ,ชำระเงิน/ใบเสร็จรับเงิน
ฉันอยากทราบว่าคุณต้องการผลการศึกษา 2020 คุณสามารถส่งคําขอออนไลน์ได้หรือไม่ เลขทะเบียน 6130736165 0959617940,ขอเอกสาร/ใบรับรอง
ทอม 2/64 นะคะ โอเคมั้ยคะ,ลงทะเบียนเรียน
ขอแบบออนไลน์สําหรับพิมพ์ตั๋วไปที่เคาท์เตอร์ได้มั้ยคะ,ขอเอกสาร/ใบรับรอง
มันแสดงให้เห็นว่าหน่วยหายไปคือจํานวนของแกดเจ็ตที่จะต้องป้อนเข้าไปในภาคการศึกษาถัดไปหรือไม่,ลงทะเบียนเรียน
สวัสดี ฉันจะอัปโหลดใบขับขี่หนึ่งใบ แต่มันลดราคา ฉันไม่คิดว่าฉันจะต้องรอหรือว่าฉันต้องทําอะไร,ขอเอกสาร/ใบรับรอง
โปรดถามเกี่ยวกับการเสร็จสิ้นฤดูกาล 1/6969L ฉันจบเกรดแล้วหลังจากนั้นประมาณ 2-3 เดือน,แจ้งจบ/ขึ้นทะเบียนบัณฑิต
ทุกปุ่มมันติด ๆ กันหมดเลยค่ะ จะดูให้พรุ่งนี้เวลาเดิมมั้ยคะ,แจ้งจบ/ขึ้นทะเบียนบัณฑิต
ระดับปริญญาโท คุณมีการเปลี่ยนแปลงเปอร์เซ็นต์หรือไม่,เกรด
แล้วเธอเอาเอกสารออนไลน์มาให้ฉันได้ไหม,ขอเอกสาร/ใบรับรอง
ฉันจ่ายเงินไปแล้วตั้งแต่วันศุกร์,ชำระเงิน/ใบเสร็จรับเงิน
สวัสดี อัญมณี อัญมณีหัตถน์ หมายเลขโทรศัพท์คือ Falko. ฉันขอใบสมัครนักเรียนในบัญชี 1 อะไรคือสถานะการนําเข้าและสามารถดาวน์โหลดได้ที่ไหน ขอบคุณนะ,ขอเอกสาร/ใบรับรอง
สวัสดี ฉันต้องการเอกสารบางอย่างเพื่อยืนยันว่าฉันเรียนออนไลน์จากยูเอสเอ็นเพื่อยกเลิกสัญญาหอพักของฉัน,ขอเอกสาร/ใบรับรอง
สวัสดี ฉันมีคําถามมากมายเกี่ยวกับปี 2020 เกรดการศึกษา ฉันสมมติว่าฉันได้รับกฎหมายการปฏิบัติ LB101 อย่างไรก็ตามในห้องเรียน A ถูกขอให้ไปที่คณะ A ตามชั้นเรียน แต่ใช้เวลามากกว่าหนึ่งเดือนเพื่อแก้ไขการเรียนลงทะเบียน ฉันยังไม่ได้แก้ไขเลย คุณช่วยตรวจสอบเบอร์นักเรียนที่ 6301640451 ได้ไหม,เกรด
ฉันจะส่งเดือนนี้กี่โมง,ขอเอกสาร/ใบรับรอง
