ทําไมนักเรียนถึงต้องใช้เงินมากขึ้นในเอกสารและตัวละครเอกของพวกเขารอบตัว? ในความเป็นจริงปัญหานี้ควรได้รับการแก้ไขอย่างเร่งด่วนและควรมีวิธีที่ดีกว่าในการจัดการขอบคุณ,ขอเอกสาร/ใบรับรอง
สวัสดี ฉันอยากจะถามว่าฉันเพิ่งจ่ายใบขับขี่ระดับบัณฑิตศึกษาในวันที่ 20 เว็บไซต์บอกว่าฉันจะส่งเอกสารการสําเร็จการศึกษาให้เธอหลังจาก 7 วัน ฉันไม่รู้ว่ามันจะพร้อมเมื่อไหร่,ชำระเงิน/ใบเสร็จรับเงิน
ฉันขอโทษมันสับสนเล็กน้อยเพราะระบบของฉันบอกว่ามันเป็นค่าส่งไปรษณีย์และจะจัดส่งภายใน 7 วันทําการ,ชำระเงิน/ใบเสร็จรับเงิน
กรณีศิษย์เก่าส่งเอกสารอิเล็กทรอนิกส์ไปยังสถานกงสุล,ขอเอกสาร/ใบรับรอง
ชายแดนของมหาวิทยาลัยเป็นแนวชายแดน ได้ยื่นคําขอโอนย้ายของมหาวิทยาลัย 10 แห่งมายังมหาวิทยาลัยแล้ว เนื่องด้วยเวลาที่ท่านตกหลุมกับสังฆ์ในสังฆราช อยู่นอกเหนือของคณะการเมือง,ลงทะเบียนเรียน
ฉันอยากจะถามอ่ะ เทอมจะพร้อมสําหรับการคืนเงินเมื่อไหร่อ่ะ,ชำระเงิน/ใบเสร็จรับเงิน
มีแบบมาตรฐานที่ต้องการมั้ยคะ,ขอเอกสาร/ใบรับรอง
หากคุณต้องการสอง,ขอเอกสาร/ใบรับรอง
เป็นไปได้ไหมที่จะขอใบรับรองออนไลน์หรือฉันต้องเข้าถึงนายทะเบียน,ขอเอกสาร/ใบรับรอง
ไง หากเธอเรียน 4 แต่เทอมสุดท้ายเหลือแค่ 2 ฉันได้รับการลงทะเบียนได้ไหมอ่ะ,ลงทะเบียนเรียน
ขอถามก่อนนะคะว่าที่สภามหาวิทยาลัยอนุมัติมารึเปล่า จะได้ประเมินผลใบประกาศคุณวุฒิได้ทุกเมื่อ รหัสคือ 6006032319,ขอเอกสาร/ใบรับรอง
ดูเหมือนว่าจะเต็มเสมอ,ลงทะเบียนเรียน
ทุกร้านมีหน้าวอเมต์กับซิกเนเจอร์มั้ยคะ,ขอเอกสาร/ใบรับรอง
"ฉันถอนหนึ่งวิชาทําไมมีเพียง 3,000 คนอ่ะ มันจะเป็น 6,000 คนเหรอ",ชำระเงิน/ใบเสร็จรับเงิน
สวัสดี ฉันอยากจะรู้เกี่ยวกับรูปที่ส่งมาที่แอพ TUpicnow มานานแล้ว แต่ฉันยังไม่ได้รับการอนุมัติดังนั้นฉันอยากจะดูว่าฉันอยากรอหรือทําอะไร,แจ้งจบ/ขึ้นทะเบียนบัณฑิต
สถานะของนักเรียนยังคงอยู่ภายใต้เงื่อนไข,สถานภาพนักศึกษา
การถอนนั้นไม่ถูกเรียกเก็บเงินจากหน่วยของขวัญหรือไม่?,ลงทะเบียนเรียน
ฉันต้องใช้เงินเดือนพริบตาไหม,ชำระเงิน/ใบเสร็จรับเงิน
ฉันต้องการใบรับรองระดับบัณฑิตศึกษา เพื่อนของฉันอยู่ในจีนเพื่อทํางาน,ขอเอกสาร/ใบรับรอง
"ค่าใช้จ่ายสําหรับเสื้อผ้านี้คืออะไร ฉันจะได้อะไรจาก 1,000 บาทจากกระดาษ ..",ชำระเงิน/ใบเสร็จรับเงิน
ฉันสามารถดูตารางเรียนหลังจากเข้าเรียนได้เมื่อใด,ลงทะเบียนเรียน
การถ่ายโอนฤดูร้อนพิสูจน์,ชำระเงิน/ใบเสร็จรับเงิน
ภาคที่ 1 ถึง 4 ต้องทําในวันที่ 17 (หนังสือสีแดง) เพียงอย่างเดียว?,ชำระเงิน/ใบเสร็จรับเงิน
หลังจากเปลี่ยนสถานะแล้ว คุณมีข้อความยืนยันมั้ยคะว่าได้ลาออกแล้ว,สถานภาพนักศึกษา
ตอนนี้มันเป็นเพราะเส้นตายในเอกสารระหว่างทางแล้ว,ขอเอกสาร/ใบรับรอง
ฉันกําลังรีบใช้เอกสาร แต่เส้นทางไม่สามารถส่งมาให้ฉันได้,ขอเอกสาร/ใบรับรอง
กลุ่มกล่าวว่าพวกเขาสามารถไปถึง 19:00 น. ก่อนการทดสอบครั้งสุดท้ายของพวกเขาดังนั้นฉันอยากรู้ว่าคุณไม่มีปัญหาในการจ่ายเงินเทอมนี้,ชำระเงิน/ใบเสร็จรับเงิน
ฉันไม่สามารถลงทะเบียนในใบขับขี่ได้,แจ้งจบ/ขึ้นทะเบียนบัณฑิต
เธอลงทะเบียน ถาดที่สาม ในวันไหนที่เธอรู้ว่าเธอจะมีการแจ้งเตือนในมือถือของเธอเหรอ,ลงทะเบียนเรียน
เหมาะสําหรับลงทะเบียน 1 ปี,ลงทะเบียนเรียน
ฉันจะจ่ายอย่างไรสําหรับภาคการศึกษา,ชำระเงิน/ใบเสร็จรับเงิน
รูปภาพโรงเรียนสําเร็จการศึกษาแล้วคุณต้องการรับอะไร,สถานภาพนักศึกษา
ระบบบอกว่าไม่เกิน 2 วันหลังจากการชําระเงิน,ชำระเงิน/ใบเสร็จรับเงิน
ไฮ ฉันอยากรู้ว่าตอนจบจะมาส่งเมื่อไหร่,ขอเอกสาร/ใบรับรอง
สวัสดี เธอช่วยขอแบบดรอปกับดูว่าพวกเรามี 3 คลาสสําหรับเทอมนี้ไหม เลขขั้นต่ําที่จะลงทะเบียนต่อเทอมนี้ เธอยังว่างที่จะเสนอหนึ่งวิชาไหมอ่ะ,ลงทะเบียนเรียน
ฉันอยากขอเอกสารหน่อย,ขอเอกสาร/ใบรับรอง
และในบางวิชาฉันคุ้นเคยกับการใช้ชื่อเดียวกันเมื่อฉันส่งงานต้องได้รับการบอกเล่าจากผู้สอนของฉันหากมีการเปลี่ยนแปลงชื่อ,ประวัตินักศึกษา
พอดีกับรีจิ้งว่าเมาส์มีค้างคาว,ชำระเงิน/ใบเสร็จรับเงิน
การลงทะเบียนล้มเหลวแต่ได้ผลลัพธ์ลงทะเบียน ฉันกลัวว่าจะมีปัญหา,ลงทะเบียนเรียน
แล้วรถมีปัญหาอะไรคะ,ชำระเงิน/ใบเสร็จรับเงิน
ที่อยู่ของเอกสารในระบบแสดงวันที่ตลอดชีวิต ... นี่หมายถึงการโหลดภายในวันที่นี้หรือไม่ หากการโหลดเกิดขึ้น แต่ไม่จําเป็นต้องใช้หลังจากวันที่กําหนดไว้?,ขอเอกสาร/ใบรับรอง
แค่เทอมที่สอง,ลงทะเบียนเรียน
ฉันถ่ายรูปการอัปเดตในแอพวิทยาลัยของฉัน ใช้เวลากี่วันนับตั้งแต่วันที่มาถึง,แจ้งจบ/ขึ้นทะเบียนบัณฑิต
อยากทราบมั้ยคะว่าต้องจ่ายค่าธรรมเนียมทางวิชาการช่วงฤดูร้อนเท่าไหร่,ชำระเงิน/ใบเสร็จรับเงิน
งั้นผมไม่มีเรียน 050 เลยครับ,ลงทะเบียนเรียน
อยากจ่ายตอนไหนคะ แล้วบอกที่อยู่ร้านหน่อยค่ะ,ชำระเงิน/ใบเสร็จรับเงิน
เนื่องจากวิชาเรียนพิเศษไม่มีหน่วยของขวัญ,ลงทะเบียนเรียน
ฉันไม่สามารถจ่ายผ่าน Mobile Banking,ชำระเงิน/ใบเสร็จรับเงิน
คุณต้องการจะมีผลอะไรต่อความอยากรู้อยากเห็นของคุณมั้ยคะ?,ลงทะเบียนเรียน
มันคือบัญชีของฉันในวันยืนยัน ดังนั้นฉันไม่แน่ใจว่าวันลงทะเบียนคือเท่าไหร่อ่ะอาร์เอ็มเอส,ลงทะเบียนเรียน
รอมหาวิทยาลัยอยู่นะ ส่งเอกสารมาให้ฉัน แล้วเธออยากจะรู้เรื่องนั้นเมื่อไหร่ละ พวกเขาไม่ยอมรับมันเพราะไม่มีอนุมัติอ่ะ,ขอเอกสาร/ใบรับรอง
พี่ไม่ได้เดินทางมาตั้งแต่วันที่ 4 ของวันที่ 4 พี่ต้องใช้มันก่อนวันที่ 14 ของวัน พี่จะติดตามที่ไหนได้,ขอเอกสาร/ใบรับรอง
หรือจะลงไปตามวันจ่ายเงินคะ,ชำระเงิน/ใบเสร็จรับเงิน
จะพร้อมเมื่อไหร่ครับ ผมจะลงชื่อเข้ารับงานนะครับ เขาต้องได้รับการอนุมัติ,ขอเอกสาร/ใบรับรอง
อยากรู้เฉยๆ จะเช็คเรื่องที่เปิดช่วงหน้าร้อนได้ยังไง,ลงทะเบียนเรียน
ฉันจะต้องทําอย่างไรหากสมมติฐานการลงทะเบียนของฉันเป็นไปไม่ได้?,ลงทะเบียนเรียน
ดังนั้นตอนนี้ฉันกําลังเพิ่มสําเนาเก่าไปยังสําเนาอื่นที่ไม่ทํางานเลยฉันต้องการรีเซ็ตมันในครั้งแรกที่ฉันเคยมี,ลงทะเบียนเรียน
ฉันอายุ 2 ปีและใบเสร็จไม่อัปเดตเป็นครึ่งราคา,ชำระเงิน/ใบเสร็จรับเงิน
สวัสดี หมายเลขลงทะเบียนคือ 6001610267 เนื่องจากสัตวแพทย์ขอให้สําเนาภาษาไทย Transcript และภาษาอังกฤษ 2 รุ่น แต่นักเรียนได้รับเวอร์ชันภาษาอังกฤษทั้ง 2 เวอร์ชัน แล้วนักเรียนต้องทําอย่างไร,ขอเอกสาร/ใบรับรอง
ฉันลงชื่อเข้าใช้แล้ว 102 แต่มันไม่ได้ถูกดึงเข้าไปในไอน้ําเอ็มเอสนะ เธอต้องทํายังไงอ่ะ,ลงทะเบียนเรียน
ไง ฉันส่งรูปไปให้เดอะ โบลบีย์ แอบบีย์มาเกือบเดือนแล้ว ฉันยังไม่เคยได้อนุมัติเลย ฉันสงสัยว่าฉันจะต้องรอหรือทําอะไรอีก เพื่อนที่ส่งของวันที่คล้ายกันยังไม่ได้รับการอนุมัติเลย แต่เพื่อนของฉันที่ส่งมันมาก่อนฉันบอกว่ามันได้รับการอนุมัติมาเร็วมากดังนั้นฉันสงสัยว่าฉันมีปัญหากับรูปหรือเปล่า,แจ้งจบ/ขึ้นทะเบียนบัณฑิต
ฉันกําลังใช้ TU สําหรับ 5 วิชา แต่ฉันมีเพียงสองลิงค์ในแทมส์,ลงทะเบียนเรียน
รหัสนักเรียนใหม่คือ 64 เธอช่วยพักให้ฉันในเทอม 1/64 ได้ไหม,ชำระเงิน/ใบเสร็จรับเงิน
การซื้อของคุณทําขึ้นแล้ว,ชำระเงิน/ใบเสร็จรับเงิน
ส่งการแจ้งเตือนไปยังสํานักงานลงทะเบียน ใช้ลิงก์ https://script.com/a/reg.tu.ac.th/macros/s/AKfycbxwrvkK41Sruy4BVrQl61LWNIGNBeyL3p8zSqpKVecjegFVc/exec?,แจ้งจบ/ขึ้นทะเบียนบัณฑิต
สวัสดีค่ะ ขอทราบชื่อนักเรียนที่ผิดประวัติได้มั้ยคะ,ประวัตินักศึกษา
มาถามกันวันนี้กันเถอะ แล้วเดี๋ยวดูว่าจะอัพเดทระบบ 1 ตุลาคมกี่วัน แล้วฉันจะได้เอกสารอิเล็กทรอนิกส์มานานแค่ไหน,ขอเอกสาร/ใบรับรอง
สวัสดีค่ะ อยากถามเรื่องค่าธรรมเนียมเซมเมอร์หน่อยค่ะ,ชำระเงิน/ใบเสร็จรับเงิน
"สวัสดี, เนื่องจากฉันมีปัญหากับการเลือกฟรี, ซึ่งเริ่มแรกคิดว่าได้นําทั้ง 2 ตัวเลือกฟรี. อย่างไรก็ตาม, ปรากฏว่า, ผู้สืบทอดถูกนับเป็นผู้สืบทอด. ส่วนที่ 2 ถูกแทนที่, ดังนั้นฉันต้องถามว่าฉันสามารถเปลี่ยนหน่วยการศึกษาฟรีได้หรือไม่. หรือจําเป็นต้องลงทะเบียนสําหรับตัวเลือกฟรีเท่านั้น.",ลงทะเบียนเรียน
สวัสดีค่ะ ช่วยถามให้หน่อยค่ะว่าคุณต้องการใบรับรองการสะกดภาษาอังกฤษใน พาสปอร์ต แอนด์ พาสปอร์ต ให้ฉันช่วยอะไรดีคะ? ขอบคุณล่วงหน้าค่ะ,ขอเอกสาร/ใบรับรอง
ฉันต้องการจ่ายค่าปรับสําหรับการทําธุรกรรมรายวันและการทําธุรกรรมอื่น ๆ เพราะมันสมเหตุสมผลและจําเป็นในอัตราที่มหาวิทยาลัยกําหนด ตามข้อ 29 ของวรรคสุดท้าย ข้อบังคับของมหาวิทยาลัยธรรมศาสตร์ว่าด้วยการศึกษาระดับบัณฑิตศึกษาในปี 2018,ชำระเงิน/ใบเสร็จรับเงิน
วันไหนคะ,ชำระเงิน/ใบเสร็จรับเงิน
สวัสดีคุณผู้หญิง ฉันต้องการให้คุณใช้บัตรรับรองของมหาวิทยาลัยของฉัน ฉันจะส่งเอกสารได้อย่างไร,ขอเอกสาร/ใบรับรอง
ฉันขอขอลงทะเบียนของคุณเป็นภาษาต่างประเทศได้ไหม?,ลงทะเบียนเรียน
สวัสดี ฉันเพิ่งสังเกตเห็นว่าชื่อฉันเป็นภาษาอังกฤษ ในประวัตินักเรียนมันสะกดผิด,ประวัตินักศึกษา
จะขอผลการศึกษา,ขอเอกสาร/ใบรับรอง
ถ้าร้านเซปซ่า เซซ่าจะฉายถ้าไปด้วยนะคะ,เกรด
ใส่เข้าไปในเบอร์แล้วเปลี่ยนเลขไปเป็นเลขทะเบียนค่ะ ทูตู แต่ยังเป็นเบอร์โทรศัพท์นะคะ,ประวัตินักศึกษา
ถ่ายภาพหนึ่งชุด,แจ้งจบ/ขึ้นทะเบียนบัณฑิต
นอกจากนี้ฉันได้ส่งรูปให้เธอที่ทียูพิคาว มันได้รับการอนุมัติแล้ว เธอไม่ต้องส่งรูปมาเหรอ,แจ้งจบ/ขึ้นทะเบียนบัณฑิต
ข้อกําหนดสําหรับการลงทะเบียนเรียนในหัวข้อที่จําเป็นในการสอน,ลงทะเบียนเรียน
มารับที่ห้างตอนเวลาทําการได้มั้ยคะ,ขอเอกสาร/ใบรับรอง
หลังจากนั้น ฉันต้องจ่ายเงินทางเข้าไหน,ชำระเงิน/ใบเสร็จรับเงิน
ขอถามก่อนนะ ถ้าคุณมี 7 วิชาแล้ว แต่มี 103 วิชาที่คุณต้องการจะถอนและเพิ่มไป 107 วิชาแทน ถ้าเราลบ 103 ออกแล้วกด 107 แต่ 107 เต็มแล้ว การยืนยันนี้ไม่ประสบความสําเร็จ รวมถึง 103 ที่ฉันลบเหรอ,ลงทะเบียนเรียน
ปุ่มนั้นใช่หรือไม่? ฉันมีใบอนุญาตระดับบัณฑิตศึกษา,แจ้งจบ/ขึ้นทะเบียนบัณฑิต
แล้วรถสามคันจะดูให้ได้ยังไงคะ ฉันคิดว่าเราน่าจะมีชื่อให้จองไว้แล้วนะคะ,ลงทะเบียนเรียน
และถ้าคุณต้องการเปลี่ยนรูปที่ TU REคัมภีร์เร็ตทําได้ไหม? รหัส 62,ประวัตินักศึกษา
ฉันจ่ายเงินให้กับมันทางไปรษณีย์ แต่มหาวิทยาลัยบอกฉันว่ามหาวิทยาลัยปิดอยู่ ฉันต้องการมันออนไลน์ แต่ระบบของฉันไม่มี,ชำระเงิน/ใบเสร็จรับเงิน
มันปรากฏขึ้นทั้งหมดเข้าด้วยกันดังนั้นคุณจึงไม่สามารถจ่ายเงินทั้งหมด 45 บาทได้,ชำระเงิน/ใบเสร็จรับเงิน
และเธอสามารถเรียนวิชาใหม่เพื่อที่เธอจะได้หาทางเข้าไม่ได้ ไม่มีคอนแทคทัค เขาไม่ตอบชั้นเรียนของเขา,ลงทะเบียนเรียน
คุณต้องการให้การสอบรับรอง Transcript จริงส่งทางไปรษณีย์เมื่อใด,ขอเอกสาร/ใบรับรอง
สวัสดีฉันเป็นนักเรียนเก่าที่มีบัณฑิตจบปี 2020 แต่ยังไม่ได้ลงทะเบียนในหมายเลขของปริญญาตรี (แป้นพิมพ์ไม่สามารถใช้ได้สําหรับหมายเลขของปริญญาตรี) ฉันจะได้รับใบอนุญาตระดับบัณฑิตศึกษาและขอใบรับรองการสําเร็จการศึกษาได้อย่างไร,แจ้งจบ/ขึ้นทะเบียนบัณฑิต
และหากคุณกําลังมองหามากกว่านักเรียนเลือกที่จะแจ้งให้คุณทราบเกี่ยวกับความล่าช้า (10-23 เมตร) จะมีผลใด ๆ ในเวลานี้ การศึกษาของนักเรียนสิ้นสุดลงที่ 1/2564 หรือไม่,แจ้งจบ/ขึ้นทะเบียนบัณฑิต
จ่าย การศึกษา ยังไง,ชำระเงิน/ใบเสร็จรับเงิน
จะส่งถึงมหาวิทยาลัยเมื่อไหร่คะ,ขอเอกสาร/ใบรับรอง
