ฮัลโหล ช่วยถามให้หน่อยได้มั้ยว่าร้านเรสโตร์ถูกลงรึยังคะ แต่พอใส่แล้ว สถานะเป็นยังไง,ลงทะเบียนเรียน
สวัสดีค่ะ ฉันอยากถามคุณหน่อยค่ะ เสขเสเสข เสเสเสข ไม่ว่างให้เรียนวันเดทที่ลานค่ะ ฉันอยากรู้ว่าเสเสข เสเสข มีเวลากลางวันและเวลาของวันค่ะ รบกวนหน่อยนะคะ,ลงทะเบียนเรียน
มีร้านอื่นเปิดอีกมั้ยคะ,ลงทะเบียนเรียน
หากสมการมาหนึ่งเทอม อะไรจะกลับไปเรียนที่ซีซีเอสได้ละ เธอเรียนสองเทอมที่ 2 ทีหลังแล้วเก็บที่เหลือจากเทอมอื่น1ปีหรืออะไรเหรอ,ลงทะเบียนเรียน
หลักฐานการศึกษาจะถูกขอสมมติฐานเก่า,ขอเอกสาร/ใบรับรอง
หรือสามารถดาวน์โหลดจากที่ใดก็ได้บนเว็บไซต์รีจี,ขอเอกสาร/ใบรับรอง
ฉันจะขอเอกสารที่คาดว่าจะจบแล้วและเอกสารเกรด จะใช้ที่ทําการไปรษณีย์ได้ไหม,ขอเอกสาร/ใบรับรอง
สวัสดี ฉันมีสถานะนักศึกษาแล้วและอยากจะถามว่าคุณสามารถรับบัตรมาตรฐานของคุณที่ธนาคารได้ไหม,สถานภาพนักศึกษา
สวัสดี ฉันต้องการขอใบรับรองออนไลน์ แต่มันไม่ทํางานเมื่อฉันกดลงในหน้าของฉันมันขึ้น,ขอเอกสาร/ใบรับรอง
ฉันได้ติดต่อพวกเขาแล้ว ฉันจะได้รับการยืนยันจากที่ไหน,ขอเอกสาร/ใบรับรอง
สวัสดี ฉันอยากจะถามว่าฉันจะได้รับบิลสําหรับเงิน 2/63 เซเมสเตอร์ที่ส่ง เนื่องจากปกติฉันจะส่งเอกสารและประทับตราบนกองพันขององค์กร,ขอเอกสาร/ใบรับรอง
สวัสดีค่ะ ต้องการให้ขอใบประกาศนียบัตรออนไลน์หลังจากล็อกบัตรลงไหมคะ,ขอเอกสาร/ใบรับรอง
ปกติแล้วเราจะจ่ายสําหรับวาระและสํานักงานลงทะเบียนหรือไม่?,ชำระเงิน/ใบเสร็จรับเงิน
สวัสดี ฉันต้องการให้คุณเป็นผู้รับเรียน จากโพสต์ที่บอกว่าการลงทะเบียนนักเรียนโรงเรียนระดับบัณฑิตศึกษาภายใน 2-5 วัน ในกรณีที่เรื่องที่ต้องป้อนก่อนที่จะลงทะเบียน มันอาจจะล่าช้าและอาจไม่มีผลใด ๆ ในวันที่ 5 หรือฉันควรจะลงทะเบียนสําหรับวันที่ 2-5 และถอนในภายหลัง,ลงทะเบียนเรียน
คุณต้องการตอบกี่วัน,ขอเอกสาร/ใบรับรอง
ฉันจะลงทะเบียนได้เมื่อไหร่,ลงทะเบียนเรียน
มันอยู่ในพื้นที่ประปาที่ฉันสามารถไปส่งที่ซัมเมอร์รังสิตได้หรือไม่,ลงทะเบียนเรียน
อย่างไรก็ตามมหาวิทยาลัยที่ฉันแจ้งไปแล้วว่าฉันได้รับเอกสาร แต่เอกสารดูเหมือนจะหายไป,ขอเอกสาร/ใบรับรอง
เมื่อฉันวางมันลงนั่นคือสิ่งที่ฉันทํา,ลงทะเบียนเรียน
"เพียงเพื่อให้คุณรู้, คําที่คุณจ่ายจะอยู่บนหลังการลงทะเบียน?",ชำระเงิน/ใบเสร็จรับเงิน
ฮัลโหล ฉันไม่แน่ใจว่าฉันจะขอเอกสารอิเล็กทรอนิกส์ได้นานแค่ไหน บอกด้วยนะว่าปกติใช้เวลากี่วัน,ขอเอกสาร/ใบรับรอง
ไปรับที่มหาวิทยาลัยได้มั้ยคะ,ขอเอกสาร/ใบรับรอง
มันยังเป็นแบบนี้และไม่สามารถทํามันได้,ลงทะเบียนเรียน
โปรไฟล์หายไป,ประวัตินักศึกษา
มีบริเวณวิทยาเขตที่จะเปิดในเดือนนี้ไหม ฉันต้องใช้เอกสารจริง ARTICLE,ขอเอกสาร/ใบรับรอง
ภาษาญี่ปุ่นมีผู้พิทักษ์จํานวนมาก แต่ผู้คนไม่ขอโควต้าถอนตัวได้,ลงทะเบียนเรียน
หากมีความล่าช้าในเทอมฉันจะต้องทําอย่างไร มีวิธีที่เธอไม่ต้องพักไหม,ชำระเงิน/ใบเสร็จรับเงิน
ฉันจะดาวน์โหลดเอกสารได้อย่างไร,ขอเอกสาร/ใบรับรอง
สวัสดีค่ะ ต้องการให้ช่วยอะไรคะ,ขอเอกสาร/ใบรับรอง
ชําระเงินเรียบร้อยแล้วค่ะ,ชำระเงิน/ใบเสร็จรับเงิน
ช่วยถามหน่อยนะ ถ้าคุณไปตอนบ่ายแล้ว แต่เธอต้องย้ายไปที่ออฟฟิศตอนเช้านี้ เธอต้องรออีกวันเพื่อยกเลิกเรื่องนั้นไหม,ลงทะเบียนเรียน
ฉันโทรไปคุยเรื่องการแก้ไขชื่อแล้วไม่มีปุ่มให้กรอกค่ะ คุณต้องการทําอะไรคะ? ขอบคุณค่ะ,แจ้งจบ/ขึ้นทะเบียนบัณฑิต
ความล่าช้าในการลงทะเบียนในกรณีพิเศษหรือไม่?,ลงทะเบียนเรียน
สวัสดีเกมส์ ซูวาร์โนติ 6324762688 เบอร์โทรศัพท์ 90972458709 ขอใบประกาศนียบัตรนักเรียนในบัญชี 1 สถานะการนําเข้าและสถานที่ที่สามารถดาวน์โหลดได้ ขอบคุณค่ะ,ขอเอกสาร/ใบรับรอง
ชื่อของฉันผิด,ประวัตินักศึกษา
มันอยู่ในภาคการศึกษาของฉัน แต่ฉันลืมจริงๆ,ชำระเงิน/ใบเสร็จรับเงิน
เธอมีเรียนฟรีเปิดวันศุกร์ไหมอ่ะ,ลงทะเบียนเรียน
ฉันได้รับการบอกให้ขอใบเรียกเก็บเงินล่าช้า แต่ฉันไม่สามารถติดต่อพวกเขาได้,ชำระเงิน/ใบเสร็จรับเงิน
อันนี้เพิ่งได้รับโน้ตใหม่ในนั้น,ลงทะเบียนเรียน
ตอนนี้ไม่ลงทะเบียน TU105 ค่ะ,ลงทะเบียนเรียน
ฉันสงสัยเกี่ยวกับเวลา 780001 ของ TU 107 ในวันที่คืออะไร เนื่องจากฉันไม่สามารถหามันได้ใน regtu,ลงทะเบียนเรียน
ฉันสามารถรับทรานสคริปต์ได้ที่ไหน,ขอเอกสาร/ใบรับรอง
ฉันลงทะเบียนเรียนฟรีหนึ่งเรียน แล้ววันสอบฟินอลตรงกับตารางหลัก,ลงทะเบียนเรียน
อยากจ่ายเป็นสองเท่าไหมคะ,ชำระเงิน/ใบเสร็จรับเงิน
คุณต้องการชําระเงินด้วยบาร์โค้ดอย่างไร?,ชำระเงิน/ใบเสร็จรับเงิน
สวัสดี ฉันได้ลงทะเบียนใบขับขี่แล้วและฉันต้องการรับเอกสารสําคัญในการศึกษาหลังจบ คุณรู้ไหมว่าฉันสามารถตรวจสอบสถานะของการส่งของฉันได้ที่ไหนเพราะฉันได้จ่ายเงินมากกว่า 7 วันทําการ,แจ้งจบ/ขึ้นทะเบียนบัณฑิต
คุณไม่สามารถเข้าถึงรูปวันอังคารได้,แจ้งจบ/ขึ้นทะเบียนบัณฑิต
ไง นิกิตติง บารัตติง พีทีบีไอ ฉันขอใบรับรองที่ได้รับการศึกษาและใบรับรองคาดว่าจะจบการศึกษาในวันที่ 9/4/2021 ไม่แน่ใจว่าฉันส่งเอกสารหรือยัง ฉันเห็นมันบนเว็บ ขอบคุณนะ,ขอเอกสาร/ใบรับรอง
ฉันขอโทษถ้าคุณใช้สําหรับใบรับรองออนไลน์ไม่รู้ว่าคุณอยู่ในหอพักของมหาวิทยาลัย คุณช่วยจองนัดสําหรับไปรับได้ไหม,ขอเอกสาร/ใบรับรอง
สวัสดี ช่วยถามทีว่าถ้า 1 หลังจากเสร็จสิ้นเกรด จะใช้เวลาเท่าไหร่ ฉันจะได้ลงทะเบียนใบขับขี่ระดับบัณฑิตศึกษาของฉัน 2. ฉันจะระบุวันที่จบการศึกษาในวันที่ 30พ.ย. 63. ถูกต้องไหม ขอบคุณนะ,แจ้งจบ/ขึ้นทะเบียนบัณฑิต
ฉันเพิ่งเข้าสู่ระบบและได้รับอนุญาตให้ขอเอกสาร,ขอเอกสาร/ใบรับรอง
สวัสดี ช่วยเอาใบรับรองคุณสมบัติจริงมาให้ฉันหน่อยได้ไหม ฉันต้องการเบอร์ที่ฉันต้องตอบ ฉันสามารถโทรและไม่มีพนักงานเสิร์ฟได้ ฉันต้องใช้เอกสารด่วนที่สุด,ขอเอกสาร/ใบรับรอง
มีปีอื่นที่ลงทะเบียนไว้สําหรับ 6-15 มั้ยคะ,ลงทะเบียนเรียน
สวัสดีจ้ะ พี่อยากให้เอกสารยาวไปหน่อยน่ะ พี่ตั้งหน้าตั้งตารอจ่ายสําหรับสองอาทิตย์ จะพร้อมตอนไหน,ขอเอกสาร/ใบรับรอง
เกณฑ์และหนังสือคุณวุฒิซึ่งคุณต้องการทําเอกสารอิเล็กทรอนิกส์ในวันนี้หรือไม่ ในวันพรุ่งนี้คุณมีสัมภาษณ์ตอนบ่าย,ขอเอกสาร/ใบรับรอง
ฉันต้องการเรียนจบ,แจ้งจบ/ขึ้นทะเบียนบัณฑิต
แล้วก็ขอนัดภายในวันที่ 21 พฤษภาคมด้วยค่ะ ขออภัยด้วยนะคะ,ขอเอกสาร/ใบรับรอง
ถ้าจะแคนเซิลให้ไปส่งล่ะ ถ้าจ่ายเงินแล้ว,ขอเอกสาร/ใบรับรอง
นี่คือใบรับรองที่ฉันออกโดยแพทย์ของฉัน,ขอเอกสาร/ใบรับรอง
หากคุณล่าช้าคุณจะจ่ายเงินสําหรับภาคการศึกษานี้กี่โมง?,ชำระเงิน/ใบเสร็จรับเงิน
ค่ะ อยากเลือกร้านไหนคะ หาไม่เจอ อยากเลือกร้านที่ไม่ระบุที่อยู่ร้านมั้ยคะ,ลงทะเบียนเรียน
พี่ต้องการการยืนยัน พี่กําลังคิดว่าจะเสร็จ เบอร์พี่ 6010613294 และเบอร์คือ 0854452244,ขอเอกสาร/ใบรับรอง
มีตัวเลือกให้จ่ายเงินมั้ยคะถ้าทําแบบนั้น,ชำระเงิน/ใบเสร็จรับเงิน
สวัสดี ในแอพทู เกรทส์ โปรไฟล์ไม่ใช่รูปปกติใช่ไหม,ประวัตินักศึกษา
ขอแจ้งให้ทราบนะคะ ฉันมี 6110611354 ซูชานรี ปลายทางที่มีความสุข วิศวกรรมโยธา ผ่าน CE221 นี่สําหรับทอมและฉันอยากได้ ence22 แต่ครูบอกว่าสํานักงานทะเบียนส่งชื่อให้แล้วค่ะ,ลงทะเบียนเรียน
ฉันมีใบอนุญาตเรียนจบแล้ว เธอต้องทําอะไรออนไลน์เหรอ,ขอเอกสาร/ใบรับรอง
ฉันจะได้รับใบรับรองสถานะนักเรียนได้อย่างไร,ขอเอกสาร/ใบรับรอง
ตอนจบจะว่างตอนกี่โมงคะ,ขอเอกสาร/ใบรับรอง
สวัสดีค่ะ กําลังจะเรียนเทอมที่ 1/64 สถานะนักเรียนคุมประพฤติค่ะ,สถานภาพนักศึกษา
ขอบคุณค่ะ แต่ทางร้านมีเอเจนซี่ที่สามารถส่งใบเสร็จมาให้ได้มั้ยคะ ต้องจดไว้ค่ะ,ชำระเงิน/ใบเสร็จรับเงิน
หากฉันส่งแบบฟอร์มชื่อฉันจะเสร็จสิ้นคําขอภายในไม่กี่วันข้างหน้า,แจ้งจบ/ขึ้นทะเบียนบัณฑิต
นี่คือใบรับรองที่แพทย์ของฉันออก,ขอเอกสาร/ใบรับรอง
"สวัสดี, ฉันต้องการถามเกี่ยวกับเอกสารใบอนุญาตการจัดเก็บสําหรับจํานวนเงินของคนรับใช้ของพลเมืองที่ต้องจ่าย.",ขอเอกสาร/ใบรับรอง
สวัสดี ถ้าเราถอนข้อสันนิษฐานของเราหนึ่งข้อและไปเพื่อไปเรียนที่มหาวิทยาลัยเพื่อสอบแทน เธออยากจะมีผลกับเกียรตินิยมไหม,เกรด
ต้องการโควต้าอะไรคะ,ลงทะเบียนเรียน
ส่วนที่เหลือของวิชาหายไปอย่างสมบูรณ์,ลงทะเบียนเรียน
ต้องการให้เช็คราคาทั้งหมดเลยมั้ยคะ,ชำระเงิน/ใบเสร็จรับเงิน
จ้ะ พี่ต้องใช้เอกสารในบันทึกของวิชาต่อไป,ขอเอกสาร/ใบรับรอง
ฉันสามารถรับใบรับรองนักเรียนออนไลน์ได้หรือไม่,ขอเอกสาร/ใบรับรอง
เพื่อนของฉันถอนมันออกและมันก็ไม่ปรากฏว่าพวกเขาอยู่ที่ไหน,ลงทะเบียนเรียน
นั่นคือคําอธิบายที่แสดงให้เห็นว่าสถานะของนักเรียนจะเป็นนักเรียนจนกว่าทุกอย่างจะเสร็จสิ้นหรือไม่?,สถานภาพนักศึกษา
ไง ฉันเป็นนักเรียน58หลัก แต่ฉันไม่ได้เข้าเรียนนะ ฉันจะพาคนอื่นไปเอาบาเชลอร์แทนตอนได้อย่างไรอ่ะ,ขอเอกสาร/ใบรับรอง
ไง ที่ติวเร็ก มีเงินจํานวนมหาศาลสําหรับเทอมสเตอร์ นี่จะโอนเธอกลับไหมอ่ะ,ชำระเงิน/ใบเสร็จรับเงิน
โปรดขอคําปรึกษา เนื่องจากคุณต้องการขอใบทรานสคริปต์เพื่อเพิ่มทุนการศึกษาที่ดีของจุฬาฯ หรือสหกรณ์ ซึ่งมักจะขอออนไลน์ เสีย 50 บาท แต่ ณ ปัจจุบันสถาณได้มอบรุ่นอิเล็กทรอนิกส์ ซึ่งไม่เข้าใจและฉันคิดว่าคุณสามารถทําเกรดของคุณได้เอง ดังนั้น ผู้ปกครองจึงกล่าวว่าพวกเขาต้องการปัญหาที่แท้จริงหรือไม่,ขอเอกสาร/ใบรับรอง
โอเค ถ้าลองแล้วจ่ายไม่ได้ก็ต้องไปธนาคารจ่ายได้มั้ย,ชำระเงิน/ใบเสร็จรับเงิน
ลงทะเบียนแล้วค่ะ,ลงทะเบียนเรียน
ฉันอยากจะขอเอกสารของซีซีแอลและจ่ายวันนี้ละ ฉันจะได้เอกสารวันไหนอ่ะ ฉันจะเลือกอีเลคโทรนิกส์,ขอเอกสาร/ใบรับรอง
สําหรับวันที่ 30 หรือเปล่าคะ,ชำระเงิน/ใบเสร็จรับเงิน
คุณมีใบรับรองการยกเลิกการพิมพ์หรือไม่?,ขอเอกสาร/ใบรับรอง
โอ้ ขอบคุณนะ ตอนแรกฉันตกใจ ฉันนึกว่าฉันจ่ายเงินไปแล้ว ฉันไม่ได้รับเอกสารอ่ะ,ชำระเงิน/ใบเสร็จรับเงิน
เว็บไซต์ยังไม่ได้ปรากฏในหน้าลงทะเบียนและฉันไม่สามารถกดทั้งหมดได้,ลงทะเบียนเรียน
ใช่ ฉันจะรู้ได้อย่างไร? พื้นที่มหาวิทยาลัยอยู่ในคําขอของคุณแล้ว,แจ้งจบ/ขึ้นทะเบียนบัณฑิต
ฉันจะขอค่าธรรมเนียมเทอมตอนปลาย เพราะฉันจ่ายผ่านภาคการศึกษาจากที่สาม เนื่องจากฉันคิดว่าฉันจะสามารถโอนภาคการศึกษาได้ (ฉันผ่านมันไปแล้ว) พีเอ็ม 1 ดังนั้นฉันไม่ได้สํารองข้อมูลเลย มีทางไหนที่ฉันแก้ไขมันได้ไหมอ่ะ,ชำระเงิน/ใบเสร็จรับเงิน
แม่ของฉันสงสัยว่าคุณสามารถจ่ายได้ในวันที่ 30 สิงหาคม ฉันสามารถจ่ายผ่านธนาคารอื่นได้ในกรณีที่เด็ก?,ชำระเงิน/ใบเสร็จรับเงิน
ฉันกําลังโทรและพวกเขาไม่ได้ส่งเอกสารให้คุณ,ขอเอกสาร/ใบรับรอง
ฉันมีคําถามค่ะ ฉันจะสมัครรับบริการสาธารณะ แต่ตอนนี้เขาต้องการคลิปไทยแล้ว,ขอเอกสาร/ใบรับรอง
ฉันถามแปลภาษาออนไลน์,ขอเอกสาร/ใบรับรอง
ขอไอบีซีซีซีซี ฤดูร้อนได้ไหม,ลงทะเบียนเรียน
ฉันขอไปทูตูเกรดหน่อยได้มั้ยคะ?,เกรด
มีตารางนัดในแอปค่ะ แล้วจะนัดเป็นวันไหนดีคะ,ชำระเงิน/ใบเสร็จรับเงิน
เมื่อไหร่ที่วิทยาลัยจะเลิกงานจะถูกส่งไปยังวิทยาลัย,ขอเอกสาร/ใบรับรอง
สวัสดี ฉันอยากจะรู้ว่าเธอสามารถนําหลักสูตรของเธอไปเรียนที่ดับเบิ้ลยูโดยไม่มีความละเอียดใดๆได้ไหม,เกรด
