ฉันอยากจะถามว่าพวกเขามีรายชื่อวิชาออนไลน์ที่เปิดสําหรับฤดูร้อนหรือไม่,ลงทะเบียนเรียน
ฉันสามารถลงทะเบียนกับใบอนุญาตระดับบัณฑิตศึกษาได้ในวันใด,แจ้งจบ/ขึ้นทะเบียนบัณฑิต
ช่วยถามทีนะ ถ้าที่อยู่ผิด ให้ส่งแบบฟอร์มคําขอทางอีเมลและต้องมาสายไหม,แจ้งจบ/ขึ้นทะเบียนบัณฑิต
ให้คอนเฟิร์มการจองกี่ครั้งคะ,ลงทะเบียนเรียน
อืม พี่ไม่เบี่ยงที่โควต้าโบรวต้าเพราะพี่คิดว่าพี่น่าจะเลือกโควต้าในวันที่ 6 นะ,ลงทะเบียนเรียน
เนื่องจากฉันได้จ่ายเงิน 50 บาทจากวันที่ 17 มีนาคมฉันไม่มีเอกสารส่งไปยังอีเมล โปรดทําอย่างนั้น,ชำระเงิน/ใบเสร็จรับเงิน
แล้วจํานวนตั๋วล่ะคะ,ขอเอกสาร/ใบรับรอง
ให้ฉันถามนะ หากเธอต้องการเรียนพิเศษเพื่อโปรเจ็กต์พิเศษ แต่ฉันลงโปรเจ็กต์ปกติ ฉันต้องลงเรียนวิชาใหม่ แต่ฉันไม่สามารถลงเรียนหลักสูตรนั้นได้ตามปกติเนื่องจากหลักสูตรเดียวกัน แต่ฉันได้ตรวจสอบเวลาที่ฉันไม่มีเรียนพิเศษ ฉันสามารถลงเรียนพิเศษได้ แต่มันเป็นโปรเจ็กต์พิเศษนะ,ลงทะเบียนเรียน
ฉันจะลงทะเบียนกับใบขับขี่ระดับบัณฑิตศึกษาได้อย่างไร,แจ้งจบ/ขึ้นทะเบียนบัณฑิต
นักดาราศาสตร์พื้นฐานด้านดาราศาสตร์สามารถศึกษาเพื่อเป็นแบบมาสเตอร์ฟรี จัดอยู่ในคณะวิทยาศาสตร์การเมือง สถานการณ์ที่พื้นฐานทางวิทยาศาสตร์และคณิตศาสตร์นับไม่นับได้ว่าเป็นวิชาเอก,ลงทะเบียนเรียน
ฉันต้องการใบรับรองออนไลน์ในวันที่ 23 กันยายน 1964 คุณจะได้รับเอกสารออนไลน์กี่วัน,ขอเอกสาร/ใบรับรอง
ต้องจ่ายประมาณ 2/2021 มั้ยคะ,ชำระเงิน/ใบเสร็จรับเงิน
สวัสดี ฉันมีเรียนซี171ไหม เธอช่วยนับเป็นหนึ่งในห้องเรียนภาษาต่างประเทศได้ไหม,ลงทะเบียนเรียน
คุณสามารถตรวจสอบที่อยู่อีเมลที่ถูกส่งไปยังชื่อและฉันไม่เห็นอีเมลกลับมา,ประวัตินักศึกษา
จะเป็น 61 นะคะ จะเสร็จสามโมงครึ่งเมื่อไหร่คะ,แจ้งจบ/ขึ้นทะเบียนบัณฑิต
กรุณาขอข้อมูลเพิ่มเติม โปรดตรวจสอบปฏิทิน ฉันได้ระบุว่าวันที่ 7 การ์เดียนถูกถอนออกจากการใช้งานของนักเรียน,สถานภาพนักศึกษา
หมายความว่าฉันลงทะเบียนเรียบร้อยแล้วสําหรับ LA101 LA111 LA161 TU117 TU104 LA364 ถูกต้องมั้ยคะ,ลงทะเบียนเรียน
นี่เป็นการลงทะเบียนหรือไม่?,ลงทะเบียนเรียน
และคุณต้องการซับเอกสารอิเล็กทรอนิกส์,ขอเอกสาร/ใบรับรอง
ขอโทษค่ะ ไม่ใช่รอบหลังนะคะ ซื้อตั๋วเรียบร้อยค่ะ,แจ้งจบ/ขึ้นทะเบียนบัณฑิต
เฮ้ คุณช่วยบอกฉันได้ไหมว่าฉันต้องการใบเสร็จสําหรับ 1/63 สําหรับภาคการศึกษา ฉันหามันไม่เจอในระบบของฉัน,ชำระเงิน/ใบเสร็จรับเงิน
ได้ค่ะ แต่คิวเต็มแล้วค่ะ,ลงทะเบียนเรียน
ฉันโทรคุยกับการแก้ไขชื่อและไม่มีปุ่มให้เสร็จสมบูรณ์ คุณต้องทําอะไร ขอบคุณนะ,แจ้งจบ/ขึ้นทะเบียนบัณฑิต
รู้อะไรมั้ย ฉันต้องการบริการออนไลน์ ฉันสามารถไปได้กี่วัน,ขอเอกสาร/ใบรับรอง
อันนี้เพิ่งได้รับบันทึกใหม่,ลงทะเบียนเรียน
มันอยู่ในหมายเลขติดต่อปัจจุบันของฉัน แต่ฉันไม่ได้ใช้,ประวัตินักศึกษา
ฉันจะขอชําระเงินได้จากที่ไหน,ขอเอกสาร/ใบรับรอง
กรุณาสอบถามค่าธรรมเนียมในฤดูร้อน คุณต้องการตรวจสอบค่าธรรมเนียมในฤดูร้อนที่ไหน? หากคุณกําลังจะลงทะเบียนเรียกเก็บเงินหรือคํานวณค่าธรรมเนียมการศึกษาของคุณ,ชำระเงิน/ใบเสร็จรับเงิน
คุณจะต้องมีเอกสารสมัครขอวีซ่าเพื่อเรียนต่อ,ขอเอกสาร/ใบรับรอง
คณะอาจารย์บอกฉันว่าเรื่องนี้ขอโควต้าที่จะเปิดในวันที่ 6,ลงทะเบียนเรียน
สวัสดีค่ะ นักเรียนอายุ 2 ขวบของฉันจ่ายค่าภาคการศึกษาผ่านแอพค่ะ ฉันมีใบเสร็จอยู่แล้ว,ชำระเงิน/ใบเสร็จรับเงิน
นั่นคือ 62 รหัสสามารถใช้กับค่าผ่านทางฟรีได้หรือไม่?,ลงทะเบียนเรียน
แน่นอนว่าเราได้รับสําเนาของ DB หรือทางไปรษณีย์หรือไม่?,ขอเอกสาร/ใบรับรอง
ขอถามแป๊บนึงนะคะ จะเช็ดเอกสารให้มาส่งทางไหนคะ,แจ้งจบ/ขึ้นทะเบียนบัณฑิต
เช็คอินเทอร์เร็กในแอพได้นะคะ ทั้งหมด 21 glitchs พร้อมถ่ายรูปค่ะ ทําไมถึงเป็นแบบนี้คะ,ลงทะเบียนเรียน
หากคุณไม่ลงชื่อเข้าใช้หัวข้อนี้คุณก็ถูกยกเลิกโดยมหาวิทยาลัย?,ลงทะเบียนเรียน
มีทางไหนที่ฉันสามารถลบรถปี 2014 ของฉันได้หรือไม่?,ลงทะเบียนเรียน
ไง ฉันมีที่อยู่อีเมลที่พร้อมส่ง สําเนาของบัตรเอทีซีและสําเนาของการแก้ไขบันทึก แต่ฉันยังไม่มีคําตอบใด ๆ เลย ดังนั้นฉันอยากจะถามว่าฉันทําการแก้ไขหรือไม่ ฉันกลัวว่าฉันไม่สามารถทํามันได้ทันเวลา คุณช่วยตรวจสอบให้ฉันหน่อยได้ไหม,ประวัตินักศึกษา
วันไหนที่ฉันจ่ายสําหรับเทอมได้อ่ะ,ชำระเงิน/ใบเสร็จรับเงิน
เอกสารส่งข้อมูลทั้งหมดมาให้ฉัน,ขอเอกสาร/ใบรับรอง
คุณจะส่งเอกสารสําคัญในวันใดถึงจุดสิ้นสุด? เว็บไซต์บอกว่า 7 วันหลังจากโอน แต่นี่ถูกโอนตั้งแต่วันที่ 4 ฉันยังไม่ได้รับ,ขอเอกสาร/ใบรับรอง
"ฉัน, ถ้าเราฝ่าฝืน, แต่ไม่ใช่การเรียนต่อเนื่อง. เธอว่างเรียนใหม่ปีหน้าไหม",ลงทะเบียนเรียน
จะส่งเอกสารสุดท้ายเมื่อไหร่,แจ้งจบ/ขึ้นทะเบียนบัณฑิต
ตัวเลือกของฉันในการดาวน์โหลดเอกสารคืออะไร,ขอเอกสาร/ใบรับรอง
ฉันอยากจะถามถ้าคุณส่งผู้เชี่ยวชาญที่จะปรากฏตัวเมื่อฤดูร้อนเลิก,แจ้งจบ/ขึ้นทะเบียนบัณฑิต
เป็นนักเรียนที่ลงทะเบียนแล้วของโครงการพิเศษ,ลงทะเบียนเรียน
ไง หมายเลขทะเบียนคือ เอทีเอฟ4 นับแต่ทหารผ่านศึกขอสําเนาใบกํากับเสียงภาษาไทยและภาษาอังกฤษ 2 รุ่น แต่นักเรียนได้รับเวอร์ชั่นภาษาอังกฤษทั้ง 2 แบบ นักเรียนต้องทํายังไงอ่ะ,ขอเอกสาร/ใบรับรอง
ขอแจ้งว่าต้องขอโควต้านะคะ จะให้ทํายังไงดีคะ,ลงทะเบียนเรียน
ดูเหมือนว่าคุณจะต้องมีใบรับรองที่ออกโดยสภามหาวิทยาลัยลง 6/2020,ขอเอกสาร/ใบรับรอง
ฉันควรขอจดหมายรับประกันอะไร,ขอเอกสาร/ใบรับรอง
รับเอกสารผ่าน myTV สําหรับวันนี้,ขอเอกสาร/ใบรับรอง
คุณมีการประกาศเกี่ยวกับการใช้ใบรับรองออนไลน์ของคุณหรือไม่?,ขอเอกสาร/ใบรับรอง
ฉันต้องการข้อมูลรับรองของวิทยาลัย,ขอเอกสาร/ใบรับรอง
เพื่อนของฉันถามว่าพวกเขามีแบบฟอร์มเพื่อรับเสียงตอบรับกับระบบการลงทะเบียนของคุณหรือไม่,ลงทะเบียนเรียน
เอกสารที่ส่งถึงเมลเอกสารจริงหรือไม่ นั่นเป็นเอกสารอิเล็กทรอนิกส์หรือไม่จริง หรืออะไร,ขอเอกสาร/ใบรับรอง
"คุณหมายความว่าอย่างไร นักเรียนจะจ่าย 2,250 บาท?",ชำระเงิน/ใบเสร็จรับเงิน
ฮัลโหล ฉันเป็นนาย Fine Arts ในสาขาจิตวิทยาสีม่วง ปีที่ 2 ภายใต้คําปราศรัยของนักเรียน Yei ก็คือนายทะเบียนได้อนุมัติให้ลาออกตั้งแต่วันที่ 16 พฤศจิกายน และจะมีผลการทดสอบ มีเงื่อนไขที่ต้องสิ้นสุดของนักเรียนก่อนวันที่ 10 เดือน แต่แอพแสดงว่าสถานะเป็นปกติ,สถานภาพนักศึกษา
ฮัลโหล ฉันอยากจะถามว่าฤดูร้อนมีกี่รายการและวันเดียวกันของการสอบในแต่ละวิชาในเวลาเดียวกัน,ลงทะเบียนเรียน
ขอโทษนะคะ อยากรู้ว่าจะได้ใบขับขี่จากบัณฑิตได้เมื่อไหร่ ช่วยเช็คให้หน่อยได้มั้ยคะ,แจ้งจบ/ขึ้นทะเบียนบัณฑิต
นั่นเป็นเหตุผลที่ฉันยืนอยู่บนการชําระเงินของฉัน 3 เดือนและ 9,ชำระเงิน/ใบเสร็จรับเงิน
สวัสดี ฉันอยากจะถามหน่อย มันอยู่ในใบขับขี่ระดับบัณฑิต แต่ทําไมเธอไม่มีชื่อในรายการเรียนจบล่ะ,แจ้งจบ/ขึ้นทะเบียนบัณฑิต
นักเรียนจะส่งมอบให้ภายในวันไหน,ขอเอกสาร/ใบรับรอง
คุณกําลังตามคําสั่งซื้อนี้ไหม มีการถอนเงินเพิ่มเติมไหม,ลงทะเบียนเรียน
สวัสดีจ้ะ พี่อยากขอนัดจบที่ 610641195 หน่อย,แจ้งจบ/ขึ้นทะเบียนบัณฑิต
โอเคค่ะ รอการยืนยัน 2 วันตามที่บอกไปนะคะ,ขอเอกสาร/ใบรับรอง
คุณจะต้องจ่ายเต็มค่าใช้จ่ายก่อนที่ระบบจะกลับสู่ด้านหลังหรือคุณจ่ายค่าธรรมเนียมสําหรับการกลับมาที่ 1500 ?,ชำระเงิน/ใบเสร็จรับเงิน
สวัสดี เบอร์นักเรียนของฉันคือ 6003612303 ไม่มีใบทะเบียนทะเบียนทะเบียนบนเว็บเรจิสตรา ฉันขอถามรุ่นนักเรียนที่จะลงทะเบียนในวันที่ได้ไหม,แจ้งจบ/ขึ้นทะเบียนบัณฑิต
ฉันไม่สามารถส่งอีเมลเกี่ยวกับบัญชีปัจจุบันของฉันได้ ทําอย่างนั้นไม่ได้ ช่วยตอบกลับทีสิ,ขอเอกสาร/ใบรับรอง
อยากทราบร้านการศึกษาหน่อยค่ะ,สถานภาพนักศึกษา
ฉันส่งเอกสารไปแล้ว แต่ไม่ผ่านอีกต่อไปดังนั้นฉันจึงต้องโทรไปหาคุณในฤดูร้อน,แจ้งจบ/ขึ้นทะเบียนบัณฑิต
ขอระดับปริญญาตรีได้มั้ยคะ แล้วก็ขอระดับปริญญาภาษาอังกฤษด้วยได้มั้ยคะ,ขอเอกสาร/ใบรับรอง
เอกสารคุณสมบัติจะพร้อมให้จัดส่งเมื่อใด,ขอเอกสาร/ใบรับรอง
ฉัน 3 ปีแล้วทํางานจนกว่าฉันจะไม่รู้วันที่ชําระเงิน คุณต้องการเรียนใหม่ไหม,ชำระเงิน/ใบเสร็จรับเงิน
สวัสดี เธอช่วยถามด้วยว่าเธอพิมพ์ใบเสร็จได้ที่เทอม วันที่ 1/2564 ได้ไหม ฉันสามารถตรวจสอบบนเว็บไซต์ได้หรือไม่ และไม่ได้โชว์ที่ ฤดูร้อน/2063,ชำระเงิน/ใบเสร็จรับเงิน
ทียู เร็ก เรามีแค่ใบรับรองออนไลน์เท่านั้น,ขอเอกสาร/ใบรับรอง
สวัสดี ฉันอยากจะถามเรื่องการจัดส่งของภาพ ฉันส่งการแก้ไขรูปให้คุณตั้งแต่ 30's แต่ฉันยังไม่ได้อนุมัติเลย,แจ้งจบ/ขึ้นทะเบียนบัณฑิต
สวัสดี ฉันอยากจะขอใบรับรองการศึกษาของเธอ อีเอ็มเอสของเธอมีกําหนดวันที่ 23 จนถึงวันที่ 29 ของวันนี้,ขอเอกสาร/ใบรับรอง
ปีที่ 4 ของนักเรียนจะเปิดออกเมื่อใด,ลงทะเบียนเรียน
ฉันไปรับที่สํานักงานนายทะเบียนได้ไหม,ขอเอกสาร/ใบรับรอง
ฉันเพิ่งลงทะเบียนวันนี้,ลงทะเบียนเรียน
โหยว จริง ๆ แล้วตอนนี้ไม่ว่าฉันจะกดกี่ครั้ง มันจะดูเหมือนว่าฉันไม่พบวิชาใด ฉันสามารถทําอะไรได้บ้าง,ลงทะเบียนเรียน
พี่อยากขอใบเสร็จสําหรับภาคการศึกษา เว้นแต่ว่าคุณจะต้องรอ 10-15 วันหลังจากที่คุณซื้อเพื่อไปรับ ถ้าคุณต้องการในคดีเร่งด่วน น้องถามได้ไหม,ชำระเงิน/ใบเสร็จรับเงิน
เกรดจากเอฟจะได้รับการแก้ไขหรือไม่?,เกรด
อ่อ งั้นรอบนั้นจะแจ้งให้ทราบนะคะ ถึงแม้พี่จะเช็คเมนูเช็คแล้ว พี่จะเช็คไม่ได้เพราะข้อมูลที่แน่นอนไม่อัพเดทจะเป็น 61 คอร์ส ถูกไหมคะ,แจ้งจบ/ขึ้นทะเบียนบัณฑิต
ฉันขอถามสําหรับเทอมได้ไหม เธอจะไปเดตกี่โมงสําหรับเทอมอ่ะ,ชำระเงิน/ใบเสร็จรับเงิน
นักเรียนอายุ 4 ปีสามารถลงทะเบียนเกิน 22 ปีได้หรือไม่?,ลงทะเบียนเรียน
ฉันต้องการถามเกี่ยวกับตอนจบของเอกสาร,แจ้งจบ/ขึ้นทะเบียนบัณฑิต
ดีจัง วันไหนที่ราคาของภาคการศึกษาอ่ะ ในกรณีที่ฉันจ่ายเต็มเหรอ,ชำระเงิน/ใบเสร็จรับเงิน
ฉันจะได้บิลสําหรับเทอมได้ที่ไหน ฉันจะจ่ายผ่านแอพธนาคาร,ชำระเงิน/ใบเสร็จรับเงิน
ให้ฉันถามอีกครั้งนะ ในกรณีที่เธอไม่สามารถออกไปจ่ายเงินสําหรับใบรับรองของธนาคารได้ เธอมีวิธีอื่นในการจ่ายเงินไหมอ่ะ,ชำระเงิน/ใบเสร็จรับเงิน
มันลงทะเบียนแล้ว,ลงทะเบียนเรียน
สวัสดี ฉันจะถามว่าฉันได้ลงทะเบียน 63 หรือไม่ แต่ฉันยังไม่ได้จ่ายเงินสําหรับข้อสรุปเลย ฉันต้องลงทะเบียนเมื่อไหร่อ่ะ,ลงทะเบียนเรียน
อยากได้แบบอิเล็กทรอนิกส์ค่ะ,ขอเอกสาร/ใบรับรอง
ถ้าเป็นเช่นนั้นคุณจะไม่สามารถบอกได้ว่ามันจบแล้ว?,แจ้งจบ/ขึ้นทะเบียนบัณฑิต
สวัสดี ฉันเป็นนักศึกษามหาวิทยาลัย ฉันอยากรู้ว่าฉันต้องทําอะไรหากฉันต้องการเรียนระดับปริญญาตรี,ขอเอกสาร/ใบรับรอง
ฉันกล่าวถึงเลิก การสอบทั้งหมดแล้วเกรดออกแล้ว,แจ้งจบ/ขึ้นทะเบียนบัณฑิต
ขอถามก่อนนะคะ ถ้าแจ้งเรื่องซีซั่น 3/2020 แล้วอัปโหลดไฟล์ให้ลิงก์ในเอกสารสุดท้าย ต้องซ่อมอีกมั้ยคะ,แจ้งจบ/ขึ้นทะเบียนบัณฑิต
เว็บไซต์ของนายทะเบียนไม่สามารถพิมพ์ใบเสร็จได้,ชำระเงิน/ใบเสร็จรับเงิน
แค่อยากรู้เฉยๆ ทวนนามสกุลให้ฟังนะคะ มีอะไรให้ช่วยมั้ยคะ,ประวัตินักศึกษา
