หมายถึงเป็นวิชาที่ตีพิมพ์เพิ่มเองครับ,ลงทะเบียนเรียน
มีเหลือเรียนเทอมนี้อีก  เรือนร่าง,แจ้งจบ/ขึ้นทะเบียนบัณฑิต
อ๋อกราบขอบพระคุณค่ะ ตอนเริ่มต้นตกใจ นึกว่าชำระเงินไปยังแล้ว จะไม่ได้รับเอกสาร,ชำระเงิน/ใบเสร็จรับเงิน
ใบบ่งชี้รายวิชาจุดมีระดับครับ,เกรด
ใบจ่ายค่าลงทะเบียนมีอายุกี่ช่วงวันคะ,ชำระเงิน/ใบเสร็จรับเงิน
นักศึกษาอีกครั้งกรอกชีวประวัติผิด,ประวัตินักศึกษา
สวัสดีค่ะ มีแบบฟอร์มคำร้องต่อคณะ เพื่อยื่่นเหตุการณ์ชำระเงินล่าช้ามั้ยคะ,ชำระเงิน/ใบเสร็จรับเงิน
สวัสดีครับถ้าจะยื่นคำร้องขอทำให้เพิ่มรายวิชา ไม่ทราบว่าต้องส่งเส้นทางไหนครับ,ลงทะเบียนเรียน
ซักไซ้การแจ้งจนเป็นนิสัยล่าช้าต้องทำอย่างไรคะ ทำได้ไปถึงวันเท่าไหร่คะ,แจ้งจบ/ขึ้นทะเบียนบัณฑิต
พอดีว่าจะแจ้งอวสาน,แจ้งจบ/ขึ้นทะเบียนบัณฑิต
แล้ววิชาเสรีนี่คือวิชาที่ไม่ใช่ของคณะด้วยเองใช่ไหมคะ,ลงทะเบียนเรียน
เพราะขอฟอร์มอิเล็กทรอนิกก็ต้องเสียเงินอีก,ขอเอกสาร/ใบรับรอง
แล้วถ้าลงทะเบียนวิชานี้ในช่วงทำให้เพิ่มเบิกใหม่ทำได้ไหมคะ,ลงทะเบียนเรียน
และ3รถตรวจสอบได้มายังไงคะ ว่าเรามีชื่ออาศัยในเซคนั้นแล้วจริงๆ,ลงทะเบียนเรียน
สามารถไปขอเอกสารจุดสำนักทะเบียนได้มามั้ยคะ,ขอเอกสาร/ใบรับรอง
สวัสดีค่ะ ขอขัดจังหวะซักไซ้ข้อมูลเรื่องส่วนลดค่าเทอม / ค่ะ,ชำระเงิน/ใบเสร็จรับเงิน
แล้วถ้ายังไม่ได้ลงทะเบียนเรื่องขอลดค่าเทอมต้องทำอย่างไรคะ,ลงทะเบียนเรียน
เรื่องส่งเอกสารขึ้นทะเบียนนักศึกษาใหมไปยังมาถึงไหนแล้วครับ,ขอเอกสาร/ใบรับรอง
อยากได้ข้อมูล ค่าใช้จ่ายตบอดคอร์ส,ชำระเงิน/ใบเสร็จรับเงิน
ส่งอีเมลล์ขอทำการแก้ไขที่อยู่ไปยังเมื่อวันกันยายนค่ะ,ประวัตินักศึกษา
หนูอยู่ชั้นแล้ว ทำงานจนไม่รู้วันจ่ายตัวเงินค่ะ แบบนี้ต้องเรียนที่ยังไม่ใช้มั้ยคะ,ชำระเงิน/ใบเสร็จรับเงิน
ต้องจ่ายค่าเทอมก่อนก่อนใช่ไหมคะถึงจะกลับมาเรียนปกติรับ,ชำระเงิน/ใบเสร็จรับเงิน
ในเวิล์ดไวด์เว็บ reg tu คำว่าคาร์ซีทเต็มกับข้าวโควตาเต็มต่างกันยังไงหรอครับ ,ลงทะเบียนเรียน
แต่เทอมนี้หนูตีพิมพ์หน่วยกิตรายวิชาครบแล้ว,ลงทะเบียนเรียน
ขออนุญาตซักไซ้เรื่องการส่งเอกสารถอนค่าเทอมราคาาๆ,ขอเอกสาร/ใบรับรอง
ขึ้นทะเบียนบัณฑิตไม่ได้ค่ะ,แจ้งจบ/ขึ้นทะเบียนบัณฑิต
ซักไซ้คะ คือต้องการแก้ไขข้อมูลชีวประวัตินักศึกษาต้องเคลื่อนไหวยังไงบ้างคะ,ประวัตินักศึกษา
ลงทะเบียนเพิ่ม/เบิก,ลงทะเบียนเรียน
แต่เสรีตีพิมพ์ไป  ร่างค่ะ,ลงทะเบียนเรียน
ขอซักไซ้เรื่องการทำให้หมดไปค่าเทอมล่าช้าครับ,ชำระเงิน/ใบเสร็จรับเงิน
แบบฟอร์มคำร้องลาออกค้นหาได้ที่ไหนครับ,ขอเอกสาร/ใบรับรอง
หรือขึ้นทะเบียนบัณฑิตได้แค่คู่เดียวแค่กันยายน ต่อชั้น,แจ้งจบ/ขึ้นทะเบียนบัณฑิต
ซีเนียร์คะ หนุไม่รับค้างต่าสมุดค่ะ,ชำระเงิน/ใบเสร็จรับเงิน
จ่ายค่าภาคเรียนล่าช้าได้ตอนไหนคะ,ชำระเงิน/ใบเสร็จรับเงิน
มันขึ้นเป็นหวยติดต่อขณะนี้ค่ะ แต่ขณะนี้ไม่ได้ใช้แล้ว,ประวัตินักศึกษา
ซักไซ้หน่อยคะะ พอดีขอใบทรานสคริปออนไลน์ไป กี่วันถึงรับอ่ะคะ,ขอเอกสาร/ใบรับรอง
ต้องตีพิมพ์ช่วงเวลา-ใหม่ใช่ไหมคะ,ลงทะเบียนเรียน
ชำระตาม24_ชั่วโมงกำหนด,ชำระเงิน/ใบเสร็จรับเงิน
สวัสดีครับ คือผมสงสัยว่าวิชา tu ชั้นนี้เปิดสอนแค่เทอม  หรอครับ,ลงทะเบียนเรียน
การส่งทรานสริปชนิด ems จะมาหมายเลข ems อนุญาตให้ตรวจไหมคะ,ขอเอกสาร/ใบรับรอง
แล้วตึกธนาคารมันบอกว่ามันไม่มีด้านบนให้เสีย,ชำระเงิน/ใบเสร็จรับเงิน
แต่คงต้องไปจองวิชาเพิ่มวันเพิกถอนอีกทีนึงค่ะ,ลงทะเบียนเรียน
พอดีว่าลงทะเบียนรายวิชาสิ่งปี,ลงทะเบียนเรียน
คนจุดลงทะเบียน ทำให้เพิ่ม ถอนจะยังได้รับการลดมูลค่าเทอมไหมคะ,ลงทะเบียนเรียน
สงสัยเพราะตีพิมพ์เรียนตัวนึงนอกคณะละมีนโทมัส_ยังไม่เข้าระบบมั้งคะ,ลงทะเบียนเรียน
สวัสดีค่ะ ต้องการแก้ไขที่พักอาศัยในใบแจ้งจนเป็นนิสัยการสอนค่ะ พอดีที่พักอาศัยผิดน่ะค่ะ,แจ้งจบ/ขึ้นทะเบียนบัณฑิต
ละผมตีพิมพ์ผิดเซคต้องเสียวิชาบาทาเลยหรอครับ,ลงทะเบียนเรียน
ด้านบนล่าสุดจุดรอชำระคือค่าไฟจันทราเดือนสิงหาคมค่ะ,ชำระเงิน/ใบเสร็จรับเงิน
หนูเรียนภาคเรียนนี้เทอมสุดท้ายค่ะ ลงทะเบียนครบหมดแล้ว,ลงทะเบียนเรียน
ถ้าเป็นงานพิเศษ รายวิชาจุดลงทะเบียนก็หายคล้ายกันใช่ไหมคะ,ลงทะเบียนเรียน
ทางมหาลัยเปิดให้จ่ายนอกรอบหรอคะ จ่ายได้มาเลยใช่ไหมคะ,ชำระเงิน/ใบเสร็จรับเงิน
พรุ่งนี้เลยกะว่าจะไปจ่ายที่แบงค์แทนค่ะ,ชำระเงิน/ใบเสร็จรับเงิน
ขอประกาศนียบัตรการเป็นนักศึกษาใช้เวลากี่วันถึงจะได้คะ,ขอเอกสาร/ใบรับรอง
ผมจะได้ใบนี้ทันวัน  หรือไม่ครับ,ขอเอกสาร/ใบรับรอง
จะสามารถยื่นขอปลอบประโลมชำระได้มั้ยคะ,ชำระเงิน/ใบเสร็จรับเงิน
ถ้านักศึกษาจุดจ่ายค่าธรรมเนียมไปยังเเล้วเนี่ย,ชำระเงิน/ใบเสร็จรับเงิน
ช่วงนี้น้องเรียนออนไลน์ค่าเทอมลดอนุญาตให้ไหมคะผู้สอน,ชำระเงิน/ใบเสร็จรับเงิน
หนูจดทะเบียนบ่าช้าแต่มันไม่มีปุ่มให้ดันอะค่ะ เป็นเจ้าของแต่จดทะเบียนซึ่งมีจิตปกติ,ลงทะเบียนเรียน
สวัสดีค่ะ ขัดจังหวะซักไซ้เรื่องแจ้งจบการศึกษาหน่อยค่ะ,แจ้งจบ/ขึ้นทะเบียนบัณฑิต
การส่งทรงชุดครุยแจ้งจนเป็นนิสัยการศึกษาสามารถส่งได้มาถึง24_ชั่วโมงไหนคะ,แจ้งจบ/ขึ้นทะเบียนบัณฑิต
สามารถขอประกาศนียบัตรผลการศึกษาได้วิถีไหนคะ,ขอเอกสาร/ใบรับรอง
ประกาศนียบัตรผลการศึกษากับใบรายงานผลการศึกษาคือฟอร์มเดียวกันมั้ยคะ,ขอเอกสาร/ใบรับรอง
รบกวนด้วยนะคะ พอดีว่าต้องตีพิมพ์วิชาเรียนค่ะ,ลงทะเบียนเรียน
ดิฉันขอใบtranscript ออนไลน์ไปตั้งแต่วัน // วันนี้ยังไม่รับเลยค่ะ,ขอเอกสาร/ใบรับรอง
แล้วต้องไปเยียวยาสถาณภาพอย่างไร,สถานภาพนักศึกษา
สวัสดีค่ะ เป็นมีปัญหากับการจดทะเบียนรายวิชาค่ะ,ลงทะเบียนเรียน
ถ้าทำให้เพิ่มถอนของภาคพิเศษต้องเสียเงินด้วยหรอครับ,ลงทะเบียนเรียน
ซักไซ้ค่ะ​ ประกาศนียบัตรการสอบไล่​ กับใบสิ้นสุดใช่อันเดียวกันมั้ยคะ,ขอเอกสาร/ใบรับรอง
ขัดจังหวะซักไซ้ครับถ้าทำการเบิกรายวิชาเสรีจะส่งผลอะไรไหมครับ,ลงทะเบียนเรียน
กราบขอบพระคุณมากๆนะคะ คือชำระได้ทุกตึกธนาคารใช่ไหมคะ,ชำระเงิน/ใบเสร็จรับเงิน
จนเสียเงินขอทำให้เพิ่มไปแล้วค่ะ โลเรตต้า_ยังไม่รับเลย,ชำระเงิน/ใบเสร็จรับเงิน
อย่างน่าพอใจครับ ขึ้นปุป แล้วจ่ายที่ทำด้วยเงิน แล้วรออีก  24_ชั่วโมงนะครับ,ชำระเงิน/ใบเสร็จรับเงิน
แจ้งจนเป็นนิสัยสกุลผิด,แจ้งจบ/ขึ้นทะเบียนบัณฑิต
ของเพื่อนไม่มองออกต้องแจกเลยค่ะ,ชำระเงิน/ใบเสร็จรับเงิน
ค่าปรับการทำให้เพิ่มวิชาภายหลัง ต้องชำระผ่านหน้าต่างไหนครับ,ชำระเงิน/ใบเสร็จรับเงิน
ตรงหมายเหตุ รายวิชาจุดต้องขอโควต้า ต้องทำเรื่องยังไงหรอค่ะ,ลงทะเบียนเรียน
แจ้งจนเป็นนิสัย  ชั้นกึ่งได้รับที่ไหนคะ,แจ้งจบ/ขึ้นทะเบียนบัณฑิต
แล้วtranscriptชนิดเลเวลครบก็โดยพร้อมเพรียงกันปะครับ,ขอเอกสาร/ใบรับรอง
ช่งเพิ่ม-เบิกวิชา,ลงทะเบียนเรียน
จดทะเบียนวิถีไหนได้บ้างครับ,ลงทะเบียนเรียน
ดีกรีซัมเมอร์หนูโทมัส_ยังไม่พอ,เกรด
อะตัวเคค่าา เอกสารจะส่งมาทางไหน และใช้เวลาประมาณกี่กลางวันเทรดา,ขอเอกสาร/ใบรับรอง
ขอซักไซ้ค่ะ ถ้าราคาเทอมใต้,ชำระเงิน/ใบเสร็จรับเงิน
จดทะเบียนวันนี้มูลค่าภาคเรียนก็ยังไม่ลดหรอคะ,ลงทะเบียนเรียน
ตรงป.จุดได้รับอ่ะค่ะ,แจ้งจบ/ขึ้นทะเบียนบัณฑิต
ใน reg อ่ะค่ะ ตัวสะกดมันไม่ยืนตรงกับข้าวบัตรประจำตัวประชาชน,ประวัตินักศึกษา
ต้องการซักไซ้ว่า จะทำเรื่องขอแจ้งจนเป็นนิสัยกรอบช้า ต้องเคลื่อนไหวอย่างไรบ้างครับ,แจ้งจบ/ขึ้นทะเบียนบัณฑิต
ไผจ่ายธนาคารก็ไม่ได้รับค่ะ,ชำระเงิน/ใบเสร็จรับเงิน
อัพโหลดไปจุดปุ่มเอกสารเเจ้งสิ้นสุดเเล้วอะค่ะ,แจ้งจบ/ขึ้นทะเบียนบัณฑิต
สวัสดีค่ะ จ่ายค่าเทอมไม่ทันต้องเคลื่อนไหวยังไงหรอคะ,ชำระเงิน/ใบเสร็จรับเงิน
เนื่องจากต้องทำเรื่องเบิกเงินก่อน ถึงกำหนดวันจ่ายค่าลงทะเบียนค่ะ,ชำระเงิน/ใบเสร็จรับเงิน
ขอซักไซ้เกี่ยวกับลงทะเบียนเรียนสิ่งนักเรียนชั้นปี  คณะศิลปศาสตร์ครับ,ลงทะเบียนเรียน
ในอินเตอร์เน็ตไซต์ไม่ขึ้นอนุญาตให้กดปุ่มลงทะเบียนเรียนอะค่ะ,ลงทะเบียนเรียน
แต่อันนี้เพิ่งลงถึงจุดสุดยอดเมื่อเช้าไม่มองออกลดเลยค่ะ?,ชำระเงิน/ใบเสร็จรับเงิน
พระเกศต้องเสียค่าปรับไหมครับ,ชำระเงิน/ใบเสร็จรับเงิน
จะตะขอเกี่ยวtranscriptค่ะ ,ขอเอกสาร/ใบรับรอง
ซักไซ้เรื่องวันลงทะเบียนเรียนระยะเวลา summer ค่ะ,ลงทะเบียนเรียน
ใบจนเป็นนิสัยจะได้มาช่วงเวลาไหนคะ,ขอเอกสาร/ใบรับรอง
ชนิดว่าชำระค่าใช้จ่ายได้ช้าสุดยี่สิบสี่ชั่วโมงไหนหรือครับ,ชำระเงิน/ใบเสร็จรับเงิน
หรือจะแจ้งศาสตร์ทำให้เพิ่มตอนใกล้ๆคะ,ลงทะเบียนเรียน
เรื่องส่งเอกสารขึ้นทะเบียนนักศึกษาใหมเดินทางถึงไหนแล้วครับ,ขอเอกสาร/ใบรับรอง
ต้องใช้เอกสารอะไรร่วมกับบิลในการถอนค่าเล่าเรียนหรอครับ,ชำระเงิน/ใบเสร็จรับเงิน
ในtu great งอกแบบนี้เป็นต้องชำระเงินยังไงคะ,ชำระเงิน/ใบเสร็จรับเงิน
สามารถยื่นรับตั้งแต่ตอนนี้เลยใช่ไหมคะ,ลงทะเบียนเรียน
ผมอยากได้บิลมูลค่าเทอม /,ชำระเงิน/ใบเสร็จรับเงิน
มองออกสำนักทรัพย์สินบอกว่าไม่ได้ส่งด้านบนไปยังนานแล้วด้วยค่ะ ตั้งแต่ช่วงโควิด,ชำระเงิน/ใบเสร็จรับเงิน
อย่างนี้ต้องเอาใบไม้จนเป็นนิสัยที่ไหนหรอคะ,ขอเอกสาร/ใบรับรอง
ถ้าขอประกาศนียบัตรสถานภาพนศ ช่วงธ.ค. จะยังขึ้นตัวยกกำลังศึกษาอาศัยมั้ยคะ,ขอเอกสาร/ใบรับรอง
ดิฉันควรทำอย่างเพื่อให้เกาะโควตาเรียนรับคะ,ลงทะเบียนเรียน
ใบแจ้งจนเป็นนิสัยคู่summerไม่ต้องให้ผู้ให้คำแนะนำเซ็นใช่มั้ยคะ,แจ้งจบ/ขึ้นทะเบียนบัณฑิต
ลงทะเบียนไปแล้วแต่ซิสเต็มไม่บันทึกให้ ต้องกระทำยังไงคะ,ลงทะเบียนเรียน
จะขอแจ้งกลายสภาพที่พักอาศัยส่งประกาศนีย์ตั๋วได้มั้ยคะ หรือต้องขออีกครั้ง,ขอเอกสาร/ใบรับรอง
เมื่อไหร่ หนังสือรับรองวุฒิจะยื่นมาคะ,ขอเอกสาร/ใบรับรอง
เป็นรหัส  นะคะ ซึ่งลงทะเบียนไปยังแล้ว,ลงทะเบียนเรียน
ขอโทษค่ะ ไม่ใช่แจ้งจนเป็นนิสัยค่ะ ใบจบการสอนอะค่ะ,แจ้งจบ/ขึ้นทะเบียนบัณฑิต
เหมือนเคยฟังจะมีค่าคงภาวะนักศึกษาค่ะ,ชำระเงิน/ใบเสร็จรับเงิน
หนูจะรู้ได้รับยังไงว่าจะต้องลงทะเบียนสาขาอะไรบ้างคะ,ลงทะเบียนเรียน
หนูจะทำเรื่องขอทรานสคริปด้วย,ขอเอกสาร/ใบรับรอง
คือมันชู้ตบารหัสไม่ได้อ่ะค่ะ,ชำระเงิน/ใบเสร็จรับเงิน
เต่ค่าเทอมจ่ายไปเเล้ว,ชำระเงิน/ใบเสร็จรับเงิน
แต่มันบอกว่าต้องCด้วยแต่มันเป็นวิชาจุดขอโควต้าอะครับ,ลงทะเบียนเรียน
จัดส่งจากต่างแดนด้วยไหมค่ะ,ขอเอกสาร/ใบรับรอง
พิมพ์ใบแจ้งราคาสินค้าที่ขายให้ชำระเงินใน tu greats ยังไงอะคะ,ชำระเงิน/ใบเสร็จรับเงิน
ใบไม้แต้ม,เกรด
อยากได้มบทรานสคริปหรือใบยุติอีกอ่ะครับ,ขอเอกสาร/ใบรับรอง
จนท.การเงินขุนเขาบอกมาแบบนี้ค่ะ ;-;,ชำระเงิน/ใบเสร็จรับเงิน
จ่ายทางซิสเต็มแล้วต้องการเอกสารไปถอนราชการสร้างยังไงคับ,ขอเอกสาร/ใบรับรอง
ก็คือสามารถยื่นเรื่องกับคณะได้ใช่มั้ยคะว่าเกาะชำระล่าช้า,ชำระเงิน/ใบเสร็จรับเงิน
ฐานะนักศึกษานักศึกษายังคือเเลบนี้อาศัย,สถานภาพนักศึกษา
ประกาศนียบัตรผลการศึกษากับใบรายงานผลการศึกษาคือโมเดลเดียวกันมั้ยคะ,ขอเอกสาร/ใบรับรอง
ซักไซ้ค่ะ ค่าบำรุงหอสมุด จำเป็น ต้องเสียมั้ยคะ,ชำระเงิน/ใบเสร็จรับเงิน
สวัสดีค่ะ ตอนทำให้เพิ่มถอนวิชา สามารถกดยืนยันได้รับกี่ครั้งคะ,ลงทะเบียนเรียน
