กดช่วยสนับสนุนไปรอบเลยอะค่ะ,ลงทะเบียนเรียน
คือผมอยากหนังสือรับรองการลงทะเบียน ต้องสัมผัสอย่างไรครับ,ขอเอกสาร/ใบรับรอง
จะได้รับใบสิ้นสุดเป็น pdf หรือว่าทางไปรษณีย์,ขอเอกสาร/ใบรับรอง
ใบบ่งชี้ผลการศึกษานี้เข้าไปขอได้ที่สำนักงานทะเบียนได้เลบไหมครับ,ขอเอกสาร/ใบรับรอง
ตรงข้อ .. ตัวอย่างเกียรตินิยมอันดับ  เกรดเฉลี่ย ไม่ใต้ .,เกรด
งั้นก็คงตีพิมพ์ไม่ทันแล้วค่ะกรุปสาขาโควต้า,ลงทะเบียนเรียน
กี่วันถึงจะรู้ค่ะว่าทำให้เพิ่มศาสตร์แล้วได้รับ,ลงทะเบียนเรียน
การจดทะเบียนทำให้เพิ่ม-เบิกในวัน  นี่สำหรับทุกชั้นปีเลยมั้ยคะ,ลงทะเบียนเรียน
ค่ะ งั้นน่าจะได้วันนี้รึเปล่าคะ เพราะจ่ายที่ทำด้วยเงินไปเมื่อวันอาทิตย์ค่า,ชำระเงิน/ใบเสร็จรับเงิน
เเล้วปกติใบที่รับรองการเป็นนศอาศัยได้นานเท่าไหร่หรอคะ,ขอเอกสาร/ใบรับรอง
ผมขอทรานสคริปเส้นทางออนไลน์เดินทางละ,ขอเอกสาร/ใบรับรอง
คือหนูยังไม่ได้กดช่วยสนับสนุนการจดทะเบียนแต่มันกดสนับสนุนไปเองอะค่ะ,ลงทะเบียนเรียน
พอดีขอประกาศนียบัตรจนเป็นนิสัยไปเป็นภาษาไทยกับอิ๊งค่ะ,ขอเอกสาร/ใบรับรอง
ใบรายงานผลการศึกษา คือ transcript ถูกต้องไหมคะพี่,ขอเอกสาร/ใบรับรอง
แต่ซักถามซีเนียร์ซีเนียร์บอกว่าปกติตัวTUจะเปิดเทอมสองด้วยอะค่ะ,ลงทะเบียนเรียน
ที่ติดต่อมาแล้วครับ,ขอเอกสาร/ใบรับรอง
จัดส่งต่างแดนด้วยไหมค่ะ,ขอเอกสาร/ใบรับรอง
จ่ายค่าเทอมล่าช้าได้เอพิโซดไหนคะ,ชำระเงิน/ใบเสร็จรับเงิน
สวัสดีค่ะ หนูขอซักไซ้เกี่ยวกับการชำระมูลค่าภาคเรียนหน่อยนะคะ,ชำระเงิน/ใบเสร็จรับเงิน
จะมี  จุดกดได้ตั้งแต่วัน  แต่ขึ้นมาด้านหน้าทำให้เพิ่มถอน,ลงทะเบียนเรียน
ผมไม่สามารถตีพิมพ์ไปส่งเอกสารใมห่อักษรอีเหนื่อยล้ามากได้ครับ,ขอเอกสาร/ใบรับรอง
ซักไซ้พิเศษค่ะ ซิสเต็มจะเปิดให้ขึ้นอีกครั้งประมานยี่สิบสี่ชั่วโมงไหนคะ,แจ้งจบ/ขึ้นทะเบียนบัณฑิต
ชำระมูลค่าเทอมสโลว์ค่ะ,ชำระเงิน/ใบเสร็จรับเงิน
ราคาต่อหน่วยค่าธรรมเนียมgreatนี่ไม่ติดได้รับมั้ยคือหรือจำเป็นต้องติด,ชำระเงิน/ใบเสร็จรับเงิน
เบิก w วันไหนนะครับแอดมิน,ลงทะเบียนเรียน
เกียวกับการแจ้งจนเป็นนิสัยการเรียนการสอนค่ะ,แจ้งจบ/ขึ้นทะเบียนบัณฑิต
เกาะใบเบิกค่าเรียน สร้างยังไงครับ,ขอเอกสาร/ใบรับรอง
ขอโทษนะครับ มีเกาะใบไม้ transcipt ไหมครับ,ขอเอกสาร/ใบรับรอง
ที่พักอาศัยคนละจุดกับขณะนี้ค่ะ,ประวัตินักศึกษา
ถ้าจดทะเบียนaudit ในใบดีกรีจะขึ้นเป็นAUDหรือเปล่าคะ,ลงทะเบียนเรียน
พอดีว่าต้องใช้เป็นเครื่องมือเอกสารเร็วๆนี้,ขอเอกสาร/ใบรับรอง
สามารถนำบิลนี้ไปทำเรื่องเลยได้มาใช่ไหมคะ ไม่ต้องมีเอกสารอื่น,ชำระเงิน/ใบเสร็จรับเงิน
คุณแม่ซักถามอีกข้อนะคะ สรุปจะได้คืนมูลค่าภาคเรียน เทอม  คนละ เท่าไรค่ะ,ชำระเงิน/ใบเสร็จรับเงิน
ไม่ค่ะอันนี้เป็นเลเวลบัณฑิตอ่ะค่ะ,แจ้งจบ/ขึ้นทะเบียนบัณฑิต
หรือว่าหนูรอตีพิมพ์ ตอนนี้แล้วจ่ายค่าเทอมเดี๋ยวนี้ฉะนั้นวงไว้เลยมั้ยคะ,ชำระเงิน/ใบเสร็จรับเงิน
จะขึ้นทะเบียนบัณฑิตแต่ไม่มีจานขึ้นทะเบียนบัณฑิตเลยค่ะ,แจ้งจบ/ขึ้นทะเบียนบัณฑิต
ขอซักไซ้ค่า ใบป.มหาลัยจะส่งมาประสาทเมื่อไรคะ,ขอเอกสาร/ใบรับรอง
พอดีหนูมีทรงพร้อมผ้านุ่งชุดครุยแล้ว หนูอัพโหลดยังไงหรอคะ,แจ้งจบ/ขึ้นทะเบียนบัณฑิต
ขอสลิปจ่ายที่ทำด้วยเงินใน tugreats ยังไงคับ กรณีชำระคือ imstallment,ชำระเงิน/ใบเสร็จรับเงิน
เมื่อไรเอกสารใบดีกรีจุดเกาะออนไลน์จะรับอะครับ,ขอเอกสาร/ใบรับรอง
หนังสือรับรองความประพฤติสามารถเกาะได้ที่ใดหรอครั,ขอเอกสาร/ใบรับรอง
จัดส่งแปลกด้วยไหมค่ะ,ขอเอกสาร/ใบรับรอง
ค่าเทอมจุดจ่ายอย่างมากเกินไปนะครับก่อนที่จะแถลงการณ์ลด,ชำระเงิน/ใบเสร็จรับเงิน
สวัสดีค่ะ ขออนุญาตซักไซ้เรื่องการแจ้งขอจนเป็นนิสัยค่ะ,แจ้งจบ/ขึ้นทะเบียนบัณฑิต
ขอรับประกาศนียบัตรภาวะนักศึกษาได้เส้นทางร่อนลงไหนคะ,ขอเอกสาร/ใบรับรอง
ถ้าได้ . เป็นได้เกียรตินิยมอันดับอะไรอ่ะคะ,เกรด
พอดีง่าชำระเงินไปแล้ว ละทางเวิล์ดไวด์เว็บก็ขึ้นว่าไม่รับขนถ่ายเดินทางรษณีอะค่ะ,ชำระเงิน/ใบเสร็จรับเงิน
สวัสดีครับ ต้องการขอประกาศนียบัตรสถานะนิสิตครับผม,ขอเอกสาร/ใบรับรอง
สวัสดีค่ะ ตอนนี้สามารถขอใบรับรองได้เลยมั้ยคะ,ขอเอกสาร/ใบรับรอง
แล้วปุ่มขอหนังสือรับรองทำไมไม่ขึ้นค่ะ,ขอเอกสาร/ใบรับรอง
ขอใบประกอบการถอนค่าภาคเรียนต้องผลิตยังไงบ้างคะ,ขอเอกสาร/ใบรับรอง
ทำประกาศนียบัตรคุณวุฒิหายอะค่ะ ต้องการขอเอกสารอีกครั้งได้รับมั้ยคะ,ขอเอกสาร/ใบรับรอง
ทำให้เป็นรูปร่างใบรับรองครับ,ขอเอกสาร/ใบรับรอง
ขอซักไซ้หน่อยค่ะ ใบวุฒการศึกษานี่จะได้มาเมื่ไหร่หรอคะ ,ขอเอกสาร/ใบรับรอง
สามารถคงฐานะไว้ก่อนจันทรามีคได้มั่ยคะ,สถานภาพนักศึกษา
ถ้าจดทะเบียนaudit ในใบดีกรีจะงอกคือAUDหรือเปล่าคะ,ลงทะเบียนเรียน
เทม.ไม่ลงทะเบียนเรียนแต่บำบัดฐานะไว้ ทำยังไงได้รับบ้างค่ะ,ลงทะเบียนเรียน
จ่ายค่าเทอมล่าช้าได้มาเอพิโซดไหนคะ,ชำระเงิน/ใบเสร็จรับเงิน
จะมีผลต่อวิชาจุดเคยขอเกี่ยวโควตาไว้ไหมคะ,ลงทะเบียนเรียน
แล้วถ้ากดปุ่มขึ้นทะเบียนบัณฑิตแล้วต้องรอเอกสารกี่ช่วงวันคะ,แจ้งจบ/ขึ้นทะเบียนบัณฑิต
ถ้าเราได้แต้ม acc,เกรด
สวัสดีค่ะพอดีจะขอ ประกาศนียบัตรภาวะการศึกษา เพื่อสมัครสอบค่ะ,สถานภาพนักศึกษา
เอกสารใบแจ้งจบจะมาใน reg หรือเมลล์ครับ,ขอเอกสาร/ใบรับรอง
นี่ขำระตัวเงินตั้งแต่วัน ,ชำระเงิน/ใบเสร็จรับเงิน
คือผมต้องใช้เอกสารนี้ในวัน  กลัวว่าถ้ายื่นทางไปรษณีย์จะมาไม่ทัน,ขอเอกสาร/ใบรับรอง
การจดทะเบียนบวก-ถอนในวัน  นี่สำหรับทุกชั้นปีเลยมั้ยคะ,ลงทะเบียนเรียน
แต่ชอยซ์มีแค่transcriptกับหนังสือรับรองค่ะ,ขอเอกสาร/ใบรับรอง
ลทบ.ยังเข้าไม่ได้เลบค่ะ วิชาตีพิมพ์เทอม บางกายเต็มไปหมดแล้วค่ะ,ลงทะเบียนเรียน
ดีกรีวางมือครบเเล้วครับ,เกรด
ขอปลอบประโลมชำระค่าจดทะเบียนค่ะ,ชำระเงิน/ใบเสร็จรับเงิน
สวัสดีค่ะเเจ้งทรงจนเป็นนิสัยไปเเล้วเเต่มันยังขึ้นรออนุมัตินานมากเเล้วอะค่ะ,แจ้งจบ/ขึ้นทะเบียนบัณฑิต
หลังช่วงทำให้เพิ่มถอนไปอีกหรอคะ,ลงทะเบียนเรียน
ค่าหอพักนิสิตนักศึกษาซัมเมอร์ไม่ขึ้นค่ะ,ชำระเงิน/ใบเสร็จรับเงิน
สมมติว่าจะถอนอยู่เเล้ว ไม่เข้าเรียนได้มั้ยคะ รอเบิกเลข,ลงทะเบียนเรียน
ตีพิมพ์ผิดครับ​ จะมาตรวจสอบผลการขนถ่ายเอกสารทางอิเล็กทรอนิกส์​,ขอเอกสาร/ใบรับรอง
ต้องทําอย่างไรถึงจะได้ ใบบนฉะนั้นเค้าประสงค์ครับ,ขอเอกสาร/ใบรับรอง
จะขอรับใบประกาศนียบัตรผ่านทางไปรษณีย์ได้มาไหมค่ะ,ขอเอกสาร/ใบรับรอง
สามารถไปรับสถานที่สำนักทะเบียนรับหรือยังครับ,ขอเอกสาร/ใบรับรอง
ส่งไปยืนยันแล้วค่ะ ต้องชำระเงินเสริมไหมคะ,ชำระเงิน/ใบเสร็จรับเงิน
ขึ้นภาวะแบบนี้จุดผลการจดทะเบียนคือทำให้เพิ่มได้เรียบร้อยใช่ไหมครับ,ลงทะเบียนเรียน
ถ้าผมเรียนอยู่ท่วงท่าจันทราแล้วสามารถตีพิมพ์วิชาเสรีของรังสิตได้ไหมครับ,ลงทะเบียนเรียน
ธรรมศาสตร์บรรจุเอกสารการเบิกค่าเล่าเรียนมั้ยคะ,ขอเอกสาร/ใบรับรอง
จะแจ้งการกลายสภาพชื่อนามสกุล,ประวัตินักศึกษา
คณะแจ้งผลเซ้มไปแล้วแต่ทำให้เพิ่มถอนวันนี้ก้ยังกดไม่ได้,ลงทะเบียนเรียน
ประกาศนียบัตรจุดคือออนไลน์ขุนเขาไม่อนุมัติอะค่ะ,ขอเอกสาร/ใบรับรอง
เป็นหนูไม่เป็นเจ้าของรายวิชา  ในตารางเรียนค่ะ,ลงทะเบียนเรียน
คือหนูก็ชำระเต็มจำนวนตั้งแต่วันแรกจุดเปิดให้จ่ายบริการเลยอ่ะค่ะ,ชำระเงิน/ใบเสร็จรับเงิน
เพิ่งขึ้นทะเบียนจนเป็นนิสัยวันกันยาอะค่ะ,แจ้งจบ/ขึ้นทะเบียนบัณฑิต
เกาะซักไซ้การขอรับใบปริญญาบัตรค่ะ,ขอเอกสาร/ใบรับรอง
แต่ยังไต่ขึ้นค้างชำระอยู่เลยค่ะ,ชำระเงิน/ใบเสร็จรับเงิน
ชำระค่าเทอมคือวันสิงหา-กันยาใช่ไหมคะ,ชำระเงิน/ใบเสร็จรับเงิน
ตัวชุดในแอพสวมใส่รูปถ่ายแล้วมันไม่สมส่วนครับ,แจ้งจบ/ขึ้นทะเบียนบัณฑิต
หมายถึงดึงTUวันทำให้เพิ่มเบิกได้มั้ยคะ,ลงทะเบียนเรียน
แจ้งยุติล่าช้าไปยังก่อนหน้านี้ไม่นานน่ะค่ะ,แจ้งจบ/ขึ้นทะเบียนบัณฑิต
ต้องการซักไซ้เรื่องเบิกวิชาค่ะ ,ลงทะเบียนเรียน
กำหนดการคืนค่าภาคเรียน24_ชั่วโมงไหนครับ,ขอเอกสาร/ใบรับรอง
คือชื่อสยามดึงดูดเหมือนเดิมแต่ว่า ชื่อภาษาอังกฤษต้องการกลายเป็น,ประวัตินักศึกษา
ซิสเต็ม บิดด้านบนไปแล้วครับ,ชำระเงิน/ใบเสร็จรับเงิน
เเล้วปกติใบที่รับรองการเป็นนศอยู่ได้รับนานเท่าไหร่หรอคะ,ขอเอกสาร/ใบรับรอง
ซีเนียร์แอด หนูขอเอกสารหนังสือรับรองได้ช่องทางไหนหรอคะ,ขอเอกสาร/ใบรับรอง
คือตีพิมพ์ใบแจ้งชำระเงินไปชำระธนาคารหรอคะ,ชำระเงิน/ใบเสร็จรับเงิน
จะตาขอผลการศึกษา,ขอเอกสาร/ใบรับรอง
กรณีศิษย์เก่า นำเอกสารอิเล็กทรอนิกส์ส่งไปมอบจุดกงสุลรับรอง,ขอเอกสาร/ใบรับรอง
สวัสดีค่า จะติดต่อขอรับใบไม้อนุปริญญาต้องทำให้ลุล่วงยังไงหรอคะ,ขอเอกสาร/ใบรับรอง
หวยศึกษาจุด0รังสิตค่ะ ลงทะเบียนของ0ท่าจันทร์,ลงทะเบียนเรียน
พิมใบดีกรีจากเว็บ reg tu ยังไงเหรอคะ,ขอเอกสาร/ใบรับรอง
TU Great App มันไม่มีข้อมูลจุดจ่ายล่่าสุดไปอ่ะค่ะ,ชำระเงิน/ใบเสร็จรับเงิน
ทางมหาลัยจะผ่านบอลมาหใ้ตอนไหนคะ,ขอเอกสาร/ใบรับรอง
หากยังไม่ถึง . จะโดนรีไทร์เลยไหมคะ,เกรด
หยุดทำการวันเสาร์วีกไหมคะ,ขอเอกสาร/ใบรับรอง
คือมันจ่ายตัวเงินใน Tu greats ไม่ได้ครับ,ชำระเงิน/ใบเสร็จรับเงิน
ถ้าขอใบทรานสคริปออนไลน์ไปแล้ว กี่วันได้มาคะ,ขอเอกสาร/ใบรับรอง
ต้องการซักไซ้ว่าจะสามารถขอใบเบิกค่าภาคเรียนรับจากไหนคะ,ขอเอกสาร/ใบรับรอง
ซักไซ้เรื่องบิลการชำระเงินมูลค่าเทอมที่จะนำไปใช้ถอนค่ะ,ชำระเงิน/ใบเสร็จรับเงิน
จะขึ้นทะเบียนบัณฑิตแต่ไม่มีรายการอาหารขึ้นทะเบียนบัณฑิตเลยค่ะ,แจ้งจบ/ขึ้นทะเบียนบัณฑิต
แจ้งจนเป็นนิสัยการศึกษา / ผ่านไปแล้วใช่มั้ยคะถ้ายังไม่ได้แจ้งต้องกระทำยังไงคะ,แจ้งจบ/ขึ้นทะเบียนบัณฑิต
สวัสดีค่ะต้องการขอใบอนุปริญญาของคณะนักแสดงนิติตัวจริงค่ะ,ขอเอกสาร/ใบรับรอง
จะแจ้งจนเป็นนิสัยเทอม/ ต้องก่อให้เกิดยังไงบ้างคะ,แจ้งจบ/ขึ้นทะเบียนบัณฑิต
พอดีว่านักศึกษามีความต้องการที่จะกลายสภาพตัวอักษรชื่อวิชาภาษาอังกฤษอ่ะค่ะ,ประวัตินักศึกษา
คือพอดีว่าคุณพ่อทะเบียนบ้านอยู่คนละจุดจานคุณแม่,ประวัตินักศึกษา
จดทะเบียนวันนี้ค่าภาคเรียนก็ยังไม่ลดหรอคะ,ลงทะเบียนเรียน
จะได้มาเอกสารบัณฑิตเมื่อไหร่หรอคะ,ขอเอกสาร/ใบรับรอง
ต้องการหนังสือรับรองการเป็นนักวิชาการค่ะ,ขอเอกสาร/ใบรับรอง
ทำไมมีบางวิชาดินค้นหาไม่เจอครับ,ลงทะเบียนเรียน
ทำเรื่องแจ้งจบไปตั้งแต่ม.ค.แล้วนะค้า,แจ้งจบ/ขึ้นทะเบียนบัณฑิต
งั้นถ้าต้องกลายสภาพชื่อ ต้องขอประกาศนียบัตรจากทางมหาลัยได้รับใช่ไหมคะ,ขอเอกสาร/ใบรับรอง
ช่วงเพิ่มเบิกจะเปิดรับมั้ยคะ,ลงทะเบียนเรียน
ตรวจสอบแล้วว่าลงทะเบียนได้ แต่พอมาตรวจสอบอีกที ซิสเต็มไม่ได้บันทึกมอบให้ค่ะ,ลงทะเบียนเรียน
ผมขอคือไฟล์อิเล็กทรอนิกส์วันนี้ได้มามั้ยครับ,ขอเอกสาร/ใบรับรอง
คือถอดความว่าภาคเรียนนี้จะต้องดรอปเรียนเพียงเลยหรอคะ,ชำระเงิน/ใบเสร็จรับเงิน
ชำระตัวเงินเรียบร้อยครับ,ชำระเงิน/ใบเสร็จรับเงิน
ขอเอกสารออนไลน์ไปเมื่อวาน จะได้วันไหนหรอคะ เกาะผ่านประสบการณ์reg tu,ขอเอกสาร/ใบรับรอง
ถ้ายังไม่รับทำการขึ้นทะเบียนบัณฑิตตต้องผลิตยังไงคะ,แจ้งจบ/ขึ้นทะเบียนบัณฑิต
ใช่ค่าแสกนจ่ายชำระเดินทางแล้วค่าๆ,ชำระเงิน/ใบเสร็จรับเงิน
เนี้ยค่ะจุดยืนชำระไปแล้ว เมื่อวันที่ จันทรา ,ชำระเงิน/ใบเสร็จรับเงิน
