คณะบัญชีคอร์สบริหารไม่ได้วิชากฎซักสาขานี่ผิดปกติมั้ยคะ,ลงทะเบียนเรียน
อ่อค่ะทำให้หมดไปเรียบร้อยแล้วค่ะ,ชำระเงิน/ใบเสร็จรับเงิน
ซักไซ้วันถอนรายวิชาติด w สิ่งเทอมนี้หน่อยค่ะ,ลงทะเบียนเรียน
เอกสารรับรองจนเป็นนิสัยการอบรมค่ะ,ขอเอกสาร/ใบรับรอง
มีผลต่อการแจ้งการจนเป็นนิสัยการศึกษา เพื่อสอบใบประกอบอาชีพที่ต้องการความรู้,แจ้งจบ/ขึ้นทะเบียนบัณฑิต
ใบดีกรี ของ มร.อัครชัย แก้วน้ำลาย  ครับ,เกรด
ค่าเทอมซัมเมอร์ การปลอบประโลม ชำระได้รับถึงเมื่อไหร่คะ,ชำระเงิน/ใบเสร็จรับเงิน
ต้องการแก้วันพระจันทร์ปีเกิดครับ,ประวัตินักศึกษา
ถ้าไม่ได้ลงทะเบียนวิชาก็โดนถอนชื่อเสียงเรียงนามจากยูใช่ไหมครับ,ลงทะเบียนเรียน
พอดีตามผลแล้วมันขึ้นว่าค้างชำระอะค่ะ แต่ว่าออกเงินไปยังแล้วน่ะค่ะ,ชำระเงิน/ใบเสร็จรับเงิน
จะรับแต้มยังไงคั,เกรด
ประกาศนียบัตรจุดเป็นออนไลน์เขาสัตว์ไม่อนุมัติอะค่ะ,ขอเอกสาร/ใบรับรอง
เพื่อที่จะนำไปยื่นให้กับทางชีวิตสำนักงานเขต,ขอเอกสาร/ใบรับรอง
สวัสดีค่า ถ้าจนเป็นนิสัย. ชั้น สถานนะจนเป็นนิสัยการศึกษาจะขึ้นประมาณช่วงไหนคะ,เกรด
ค่าเทอม / ใช้ตอนไหนคะ,ชำระเงิน/ใบเสร็จรับเงิน
จะติดต่อสอบถามเรื่องการแจ้งจนเป็นนิสัย ต้องติดต่อดิน E-mail ไหนคะ,แจ้งจบ/ขึ้นทะเบียนบัณฑิต
ได้ค่ะ พอดีต้องรีบใช้เอกสารเพื่อยื่่นเรื่องเรียนต่อ,ขอเอกสาร/ใบรับรอง
แล้วค่าเทอมคือจ่ายด้านบนเต็มหรือจ่ายยอดลดค่าภาคเรียนแล้วคะ?,ชำระเงิน/ใบเสร็จรับเงิน
จ่ายค่าเทอมไปตั้งแต่วัน กย แต่ว่าบิลโทมัส_ยังไม่ไต่ขึ้นเลยค่ะ,ชำระเงิน/ใบเสร็จรับเงิน
ขึ้นทะเบียนบัณฑิตไม่รับค่ะ,แจ้งจบ/ขึ้นทะเบียนบัณฑิต
แจ้งจนเป็นนิสัยไปตั้งแต่เทอมจุดแล้วแต่ยังไม่มีมอบกด ขึ้นทะเบียนบัณฑิตเลย,แจ้งจบ/ขึ้นทะเบียนบัณฑิต
สามารถจ่ายย้อนหลังได้ยังไงบ้างมั้ยคะ เครียดมากจริงๆค่ะ,ชำระเงิน/ใบเสร็จรับเงิน
หลักฐานเอกสารลาออกปี้ที่ไหนครับ,ขอเอกสาร/ใบรับรอง
เอกสารจุดได้จะได้เป็นฉบับลายมือจริงผ่านบอลทางไปรษณีย์หรือเปล่าคะ,ขอเอกสาร/ใบรับรอง
เรียนจุด0ลำปางอะค่ะ ขึ้น  เท้า,ชำระเงิน/ใบเสร็จรับเงิน
หนูเพิ่งสังเกตเห็นว่าตรงตำบลมันผิดค่ะไม่รู้ว่ากระเด้งเดินทางอันนั้นได้ยังไง,ประวัตินักศึกษา
เข้าลงทะเบียนเรียนไม่ได้มาอะครับ,ลงทะเบียนเรียน
ของหนู TU กับข้าว TU  ลากรายวิชามาจากโควตาอ่ะค่ะ,ลงทะเบียนเรียน
ถ้าขอจุดมหาลัยใช้เวลาเท่าไร ผมใช้สักเดือนธันวาคมครับ,ขอเอกสาร/ใบรับรอง
ถ้าถอนไปต้องไปแก้หรือเรียนใหม่ไหมครับ หรือสามารถเบิกได้เลย,ลงทะเบียนเรียน
ลองขอเอกสารออนไลน์มาแล้วครับ แต่ว่าไม่มีที่ปั๊มมอ,ขอเอกสาร/ใบรับรอง
ถ้าสมมติdrop w TUเทอม แล้วไปตีพิมพ์TUในเทอม,ลงทะเบียนเรียน
ฐานะนักศึกษาจะขึ้นว่าเป็นนิสิตอาศัยมั้ยคะ,สถานภาพนักศึกษา
จุดมันจะเป็นลายเซ็นอิเล็กทรอนิกส์จุดถอนราชการได้รับค่า,ขอเอกสาร/ใบรับรอง
สวัสดีครับ ถ้าจนเป็นนิสัยภาคเรียนจุด จะแจ้งจนเป็นนิสัยล่าช้าได้ทางไหนครับ,แจ้งจบ/ขึ้นทะเบียนบัณฑิต
ลงอีกทีเอพิโซดภาคเรียนไหนก็ได้เลยและมีสิทธิ์เกียรตินิยมเหมือนเดิมใช่มั้ยคะ,ลงทะเบียนเรียน
พอดีจนเป็นนิสัยไปแล้ว และยังไม่ได้ไปเอาใบรับปริญญาสถานที่สำนักทะเบียน,ขอเอกสาร/ใบรับรอง
แต่เพื่อนคนอื่น ไม่ต้องเสียราคาขึ้นทะเบียนอ่ะครับ,ชำระเงิน/ใบเสร็จรับเงิน
ลงทะเบียนล้มเหลวแต่ไปขึ้นผลการจดทะเบียนอะครับ พระเกศากลัวมีปัญหา,ลงทะเบียนเรียน
อย่างน่าพอใจค่ะ แล้วถ้าตีพิมพ์ หน่วยกิตเทอมหน้า ราคาเทอมเหมาใช่มั้ยคะ,ลงทะเบียนเรียน
แล้วถ้าลงทะเบียนวิชานี้ในช่วงเพิ่มเบิกใหม่ทำได้ไหมคะ,ลงทะเบียนเรียน
แต่ในแอพขึ้กำหนด - จันทรา  ค่ะ อันนี้รหัส  ค่ะ ทำเหตุการณ์เกลี้ยกล่อมไว้ค่ะ,ชำระเงิน/ใบเสร็จรับเงิน
แต่เป็นวิชาเอกข่มขู่จุดใต้ c ต้องเรียนที่ยังไม่ใช้อะค่ะ,เกรด
แจ้งจนเป็นนิสัยแผนกซ่อมล่าช้าค่ะ,แจ้งจบ/ขึ้นทะเบียนบัณฑิต
แบบนี้ถอดความว่า ฐานะนักศึกษาการศึกษา จบยังคะ,สถานภาพนักศึกษา
แล้วอาจารย์เค้าบอกว่าได้ส่งดีกรีเดินทางอีกครั้งแล้ว,เกรด
คือเพิ่งกรอกดาต้านศ ไปยังใน reg แต่กรอกผิด,ประวัตินักศึกษา
จะต้องติดต่อกับใครอย่างไรครับเพื่อขอโควต้าเรียนศาสตร์ดังกล่าวครับ,ลงทะเบียนเรียน
ทำให้เพิ่มถอนติด W ของเทอมนี้ช่วงกลางวันไหนหรอคะ,ลงทะเบียนเรียน
เเต่งงว่าต้องมีระบุพ้นภาวะ,สถานภาพนักศึกษา
ดึงสาขานั้นย้อนหลังรับไหมคะ,ลงทะเบียนเรียน
เอกสารรับรองวุฒิจะสามารถขอให้ขนถ่ายทางไปรษณีย์ได้เมื่อไหร่อะคะ,ขอเอกสาร/ใบรับรอง
ต้องประทับตราถึงจะใช้เบิกได้ใช่ไหมคะ,ขอเอกสาร/ใบรับรอง
ถ้าต้องการขอใบ transcript เพื่อยื่นฝึกงาน ช่วงเวลาปี  ซัมเมอร์,ขอเอกสาร/ใบรับรอง
มหาลัยจะส่งเอกสารจนเป็นนิสัยให้นิสิตนักศึกษาตอนไหนคะ,ขอเอกสาร/ใบรับรอง
สวัสดีมูลค่า ค่าภาคเรียนsummerเท่าไหร่เหรอคะ,ชำระเงิน/ใบเสร็จรับเงิน
จัดส่งจากต่างประเทศด้วยไหมค่ะ,ขอเอกสาร/ใบรับรอง
จะจ่ายที่ทำด้วยเงินขึ้นทะเบียนบัณฑิตแต่มันขึ้นแบบนี้ สร้างยังไงได้บ้างคะ,ชำระเงิน/ใบเสร็จรับเงิน
ถอน w วันไหนนะครับแอดมิน,ลงทะเบียนเรียน
แล้วถ้าเพื่มวิชาแล้วจะรู้รับเมื่อไรว่าเราตีพิมพ์รับ,ลงทะเบียนเรียน
แบบนี้ถอดความว่า ภาวะการศึกษา ยุติโทมัส_ยังคะ,สถานภาพนักศึกษา
ผมขอการเป็นอยู่ไฟล์อิเล็กทรอนิกส์วันนี้รับมั้ยครับ,ขอเอกสาร/ใบรับรอง
แต่พอจ่ายที่ทำด้วยเงิน ตกค้างอะค่ะ,ชำระเงิน/ใบเสร็จรับเงิน
คือเป็นรายวิชาจุดขออาจารย์มาน่ะค่ะ ไม่ได้เกาะผ่านประสบการณ์โควต้าค่ะ,ลงทะเบียนเรียน
ทำให้เพิ่มถอนวันสุดท้ายวัน  ส.ค. ทำให้เพิ่มถอนได้มาถึงกี่นาฬิกาครับ,ลงทะเบียนเรียน
มันให้จ่ายผ่านประสบการณ์แบงค์อย่างเดียวเลยค่ะ,ชำระเงิน/ใบเสร็จรับเงิน
คือต้องถอนก่อนหรือขอโควต้าก่อนค่ะ หรือก่อให้เกิดอะไรเก่าก็ได้,ลงทะเบียนเรียน
การส่งทรงชุดครุยแจ้งจนเป็นนิสัยการศึกษาสามารถส่งได้ถึงวันที่ไหนคะ,แจ้งจบ/ขึ้นทะเบียนบัณฑิต
ถ้าเเจ้งจนเป็นนิสัย เทอม/ ถึงกาลจุดขึ้นว่าจบการอบรมแล้วหรือยังคะ,แจ้งจบ/ขึ้นทะเบียนบัณฑิต
เปรียบเสมือนยืดภาวะนักศึกษาออกไป,สถานภาพนักศึกษา
จะต้องติดต่อกับใครอย่างไรครับเพื่อเกาะโควต้าเรียนศาสตร์ดังกล่าวครับ,ลงทะเบียนเรียน
เรื่องส่งเอกสารขึ้นทะเบียนนักศึกษาใหมเดินทางมาถึงไหนแล้วครับ,ขอเอกสาร/ใบรับรอง
ชำระเงินแล้ว ภาวะงอกว่ารอชำระค่ะ หมายถึงอะไรหรอคะ,ชำระเงิน/ใบเสร็จรับเงิน
ทำให้เพิ่มถอนวันสุดท้ายวัน  ส.ค. ทำให้เพิ่มถอนได้ถึงกี่น.ครับ,ลงทะเบียนเรียน
พอดีค่อนข้างรีบด้วยเพราะต้องเอาเอกสารเดินทางส่งlawfirm,ขอเอกสาร/ใบรับรอง
ถ้าขอนี้มีระยะเวลาในการรอเอกสารกี่ยี่สิบสี่ชั่วโมงครับ,ขอเอกสาร/ใบรับรอง
อย่างน่าพอใจค่ะ แล้วถ้าตีพิมพ์ หน่วยกิตเทอมหน้า มูลค่าภาคเรียนเหมา_เจ๋อตุงใช่มั้ยคะ,ลงทะเบียนเรียน
งี้ซึ่งมีหวังขึ้นก่อนจะหมดช่วงกล่าวจนเป็นนิสัยไหมนะคะ,แจ้งจบ/ขึ้นทะเบียนบัณฑิต
ขอโทษนะครับผมเป็นคนที่แจ้งจบฝ่าย /,แจ้งจบ/ขึ้นทะเบียนบัณฑิต
ไมาสามารถว่าเข้าไปขออีกครั้งได้ไหมคะ,ขอเอกสาร/ใบรับรอง
ทำไมบางคนไม่ได้ชำระ,ชำระเงิน/ใบเสร็จรับเงิน
ว่าจะตีพิมพ์ตอน12_เดือนภาคเรียนอะค่ะ,ลงทะเบียนเรียน
ถ้าผมชำระเงินแล้วแต่เอาทะเบียนของเก่าได้มั้ยครับ,ชำระเงิน/ใบเสร็จรับเงิน
ผมไม่สามารถจ่ายได้ตเองผลิตยังไงครับ,ชำระเงิน/ใบเสร็จรับเงิน
ตอนนี้ยังไม่บ่งชี้ผงการถนนไดม์โควต้าเลยค่ะ,ลงทะเบียนเรียน
แต่ขอประกาศนียบัตรออนไลน์ไม่ได้เพราะปุ่มเปิด-ปิดไม่งอกนี่มันยังไงกันคะ,ขอเอกสาร/ใบรับรอง
ผมสามารถเข้ารับอนุปริญญาตัวจริงรับยังไงบ้างคับ,ขอเอกสาร/ใบรับรอง
พอมีทางไหนที่จะไม่ต้องจ่ายต่าเทอมไหมครับ,ชำระเงิน/ใบเสร็จรับเงิน
สวัสดีครับ ขัดจังหวะสอบถามเหตุการณ์ขึ้นทะเบียนบัณฑิตหน่อยครับ,แจ้งจบ/ขึ้นทะเบียนบัณฑิต
ถ้าได้ . คือได้มาเกียรตินิยมอันดับอะไรอ่ะคะ,เกรด
พอกดดึงสาขาโควต้ามา,ลงทะเบียนเรียน
สอบยูนิตค่ะ วิชาสหเวท คู่จุดยื่นแฟ้ม จ่ายค่าธรรมเนียมกลางวันไหนค่ะ,ชำระเงิน/ใบเสร็จรับเงิน
ผมรอคำสั่งท่าน อธิการ อนุมัติให้ลงทะเบียนอาศัยครับ,ลงทะเบียนเรียน
อย่างนี้จุดชำระไปแล้ว ยังได้มาอาศัยไหมคะ,ชำระเงิน/ใบเสร็จรับเงิน
ต้องการทราบตำแหน่งการเรียนค่ะ,สถานภาพนักศึกษา
เปิดให้ทำให้เพิ่มถอนตอนกี่น.ของวันที่คับ,ลงทะเบียนเรียน
ถ้าต้องการขอใบ transcript เพื่อยื่นฝึกงาน ช่วง12_เดือน  ซัมเมอร์,ขอเอกสาร/ใบรับรอง
สามารถตีพิมพ์ทำให้เพิ่มเบิกได้รับกี่ครั้งหรอคะ,ลงทะเบียนเรียน
อันนี้ต้องขอโควต้ายังไงหรอคะ,ลงทะเบียนเรียน
จ่ายทางซิสเต็มแล้วต้องการเอกสารไปเบิกราชการผลิตยังไงคับ,ขอเอกสาร/ใบรับรอง
หรือต้องกดถอนทั้งหมดแล้วตีพิมพ์ใหม่คะ แต่ค้นหาปุ่มกดแก้ไม่ประจันหน้า,ลงทะเบียนเรียน
คือจะเข้าไปเอาใบคำร้องแต่เข้าระบบไม่ได้,ขอเอกสาร/ใบรับรอง
ใบคำร้องขอจดทะเบียนเรียนช่วงทำให้เพิ่มถอนเพื่อให้ครูเซ็นค่ะ,ขอเอกสาร/ใบรับรอง
ต้องการทราบว่า จะเบิกศาสตร์eg,ลงทะเบียนเรียน
คณะบัญชีคอร์สบริหารไม่ได้วิชาใหญ่ซักศาสตร์นี่ผิดปกติมั้ยคะ,ลงทะเบียนเรียน
สอบถามหนังสือรับรองคุณวุฒิค่ะ,ขอเอกสาร/ใบรับรอง
คือวันระดับวางมือครบใช่มั้ยคะ,เกรด
ให้มันเป็นตารางเรียนก่อนกดทำให้เพิ่มเบิกสาขาอ่ะครับ,ลงทะเบียนเรียน
ถ้าจ่ายค่าเทอมร.ร.ก่อนก็จะไม่มีจ่ายค่ามหาลัยน้องอีกค่ะอ.,ชำระเงิน/ใบเสร็จรับเงิน
หรือผมสามารถขอใบป.ของนักศึกษาจุดจนเป็นนิสัย12_เดือน  เลยรับไหมครับ,ขอเอกสาร/ใบรับรอง
ผมเพิ่งเสียผ่านออนไลน์ เมื่อกี้นี้,ชำระเงิน/ใบเสร็จรับเงิน
ซักไซ้พิเศษหน่อยค่า เอกสารจะส่งออกกลางวันไหนอ่าคะ,ขอเอกสาร/ใบรับรอง
ไม่ทราบว่าจะได้รับเอกสารทางหน้าต่างไหนคะ,ขอเอกสาร/ใบรับรอง
มีปัญหาเกี่ยวกับการถอนทำให้เพิ่มสาขาเรียนครับ,ลงทะเบียนเรียน
ถ้าเลือกอันนี้ จะได้รับบิลเหมือนกันมั้ยครับ,ชำระเงิน/ใบเสร็จรับเงิน
เอกสารร่างนี้ต้องรอนานไหมคะ,ขอเอกสาร/ใบรับรอง
ใช้โทรศัพท์ลงทะเบียนได้รับไหมคะ,ลงทะเบียนเรียน
ใบจนเป็นนิสัยค่ะ,ขอเอกสาร/ใบรับรอง
แล้วเอกสารจะได้หลังจากนั้นกี่กลางวันครับผม,ขอเอกสาร/ใบรับรอง
ต้องการจะทราบว่าพอจะทราบมั้ยคะว่าจัดส่งเอกสารมอบรึยัง,ขอเอกสาร/ใบรับรอง
ชำระค่าเทอมคือวันสิงหา-ก.ย.ใช่ไหมคะ,ชำระเงิน/ใบเสร็จรับเงิน
การขอเทียบโอนผลคะเเนนรายศาสตร์(ดีกรี),เกรด
ผมลงทะเบียนเรียนไปเรือนกายแล้ว,ลงทะเบียนเรียน
โอนจ่ายธาตุเงินแล้ว,ชำระเงิน/ใบเสร็จรับเงิน
ไม่สามารถชำระย้อนหลัง พร้อมชำระค่าปรับรับใช่มั๊ยคะ,ชำระเงิน/ใบเสร็จรับเงิน
การขอเทียบโอนผลคะเเนนรายวิชา(เกรด),เกรด
ต้องการให้มหาลัยส่ง transcript ให้มหาลัยในตปท ใช้สมัครเรียนรู้ตัวต่อ,ขอเอกสาร/ใบรับรอง
ตอนนี้เปลี้ยนเป็นรหัสบัตรกลุ่มพลเมืองเดิมแล้วค่ะ,ประวัตินักศึกษา
เอกสารจนเป็นนิสัยจะผ่านบอลเอพิโซดไหนหรอคะ,แจ้งจบ/ขึ้นทะเบียนบัณฑิต
ถ้าแบบนี้คือยังแจ้งจบไม่ได้หรอคะ,แจ้งจบ/ขึ้นทะเบียนบัณฑิต
ไปขอทำเรื่องปลอบโยนย้อนหลังได้ใหมค่ะ,ชำระเงิน/ใบเสร็จรับเงิน
ขอใบประกอบการถอนค่าเทอมต้องผลิตยังไงบ้างคะ,ขอเอกสาร/ใบรับรอง
เปรียบเสมือนยืดฐานะนักศึกษานักศึกษาออกไป,สถานภาพนักศึกษา
แต่เสรีตีพิมพ์ไป  กายค่ะ,ลงทะเบียนเรียน
ขอสอบหน่อย เรื่องขอประกาศนียบัตรคาดว่าจะจบ ต้องขอทางไหนคะ,ขอเอกสาร/ใบรับรอง
