ขัดจังหวะซักไซ้ครับถ้าทำการเบิกรายวิชาเสรีจะส่งผลกระทบอะไรไหมครับ,ลงทะเบียนเรียน
สวัสดีค่ะ หนูขอซักไซ้เกี่ยวกับการชำระราคาเทอมหน่อยนะคะ,ชำระเงิน/ใบเสร็จรับเงิน
วิชาจุดตกค้างหายหมดเลย,ลงทะเบียนเรียน
แทนเกรดค่ะ,เกรด
สามารถขอประกาศนียบัตรผลการศึกษาได้ทางสัญจรไหนคะ,ขอเอกสาร/ใบรับรอง
สามารถขอบิลค่าเทอมได้จากทางสัญจรไหนหรอคะ,ขอเอกสาร/ใบรับรอง
ไม่ ทราบว่าต้องขออีกครั้งไหมคะ,ขอเอกสาร/ใบรับรอง
มันเข้สในระะบบเลยใช่มั้ยว่าออกเงินแล้วว,ชำระเงิน/ใบเสร็จรับเงิน
จ่ายค่าเทอมไม่ทันทำยังไงหรอคะ,ชำระเงิน/ใบเสร็จรับเงิน
สวัสดีค่ะต้องการขอใบอนุปริญญาสิ่งคณะนิติตัวจริงค่ะ,ขอเอกสาร/ใบรับรอง
สวัสดีค่ะ ตอนนี้สำนักทะเบียนเปิดให้ไปรับเอกสารด้วยตัวเองหรือยังคะ,ขอเอกสาร/ใบรับรอง
จ่ายราคาภาคเรียนไม่ทันค่ะ,ชำระเงิน/ใบเสร็จรับเงิน
ไม่ใช่ค่ะ คือคิดว่าออกดีกรี GPAX ผิด ต้องติดต่อลู่ทางไหนคะ,เกรด
เข้าไปรับใบป.ที่สำนักทะเบียนแทน*,ขอเอกสาร/ใบรับรอง
เพราะไม่มีที่ปั๊มอ่ะค่ะ,ขอเอกสาร/ใบรับรอง
มันไม่ขึ้นในให้ดึงโควต้าอะครับ,ลงทะเบียนเรียน
แล้วต้องเสียค่าใช้จ่ายกะประมาณเท่าไหร่ครับ,ชำระเงิน/ใบเสร็จรับเงิน
ภาพไปถ่ายจุดร้านแล้วสแกนส่งได้รับไหมคะ หรือต้องจากแอพเพียง,แจ้งจบ/ขึ้นทะเบียนบัณฑิต
ขอออนไลน์แล้วรับเป็นไฟล์pdf ต้องเคลื่อนไหวยังไงบ้างนะครับ,ขอเอกสาร/ใบรับรอง
เเต่ว่าชำระรายจ่ายเดินทางหมดเเล้วนานเเล้วนะคะ,ชำระเงิน/ใบเสร็จรับเงิน
ของหนูเป็นทำให้เพิ่มค่ะหลังจากนั้นซึ่งตั้งตรงเพิ่ม-เบิก,ลงทะเบียนเรียน
หนูสามารถแจ้งจนเป็นนิสัยในช่วงเวลาใดได้บ้างคะ หรือเป็นเจ้าของวิธีแก้ไขยังไงบ้างคะ,แจ้งจบ/ขึ้นทะเบียนบัณฑิต
พอดีคุณพ่อนำไปถอนกับทางราชการแล้วเค้าแจ้งว่าให้ปั๊มด้วยค่ะ,ขอเอกสาร/ใบรับรอง
เอกสารจุดต้องรอตัวจริงส่งมา ตอนนี้โลเรตต้า_ยังไม่เป็นเจ้าของการจัดส่งใช่ไหมคะ,ขอเอกสาร/ใบรับรอง
แต่อาจารย์เอกก็บอกผมแล้วว่ากั๊กที่ไว้มอบเก็กเอกแล้ว,ลงทะเบียนเรียน
เลยต้องการอัพโหลดไฟล์การแจ้งจบอีกครั้ง,แจ้งจบ/ขึ้นทะเบียนบัณฑิต
สามารถขอเอกสารประกอบการถอนค่าเล่าเรียนได้ที่ไหนคะ,ขอเอกสาร/ใบรับรอง
ส่งไปกล่าวแล้วค่ะ ต้องชำระเงินพิเศษไหมคะ,ชำระเงิน/ใบเสร็จรับเงิน
ช่วงนี้ไปเอาใบไม้วุฒิได้ที่ไหนครัย,ขอเอกสาร/ใบรับรอง
เป็นไม่สามารถลงทะเบียนได้มาเลยใช่ไหมคะ,ลงทะเบียนเรียน
จะขัดจังหวะตะขอระเบียบการถอนค่าเล่าเรียนค่ะ,ขอเอกสาร/ใบรับรอง
หมายถึงดึงTUวันทำให้เพิ่มเบิกได้มามั้ยคะ,ลงทะเบียนเรียน
เขาจะมีสแตมป์และลายเซ้นทุกหน้าตาไหมค่ะ,ขอเอกสาร/ใบรับรอง
มองออกแจ้งในซิสเต็มว่า งดเอาเอกสารด้วยตัวเองและทางไปรษณีย์ค่ะ,ขอเอกสาร/ใบรับรอง
โอนไปยังตั้งแต่วันที่ค่ะ,ชำระเงิน/ใบเสร็จรับเงิน
ค่าเทอมเทอมนี้ ถ้าตีพิมพ์เรียนศาสตร์เดียวค่าเทอมเท่าไรเหรอคะ,ชำระเงิน/ใบเสร็จรับเงิน
ถอนประชิด W สามารถเบิกกี่ครั้งก็ได้จนกว่าจะหมดเขตใช่มั้ยคะ,ลงทะเบียนเรียน
ทางม.ได้ทำประกาศเรื่องการใช้ใบรับรองออนไลน์ไหมคะ,ขอเอกสาร/ใบรับรอง
สามารถจับภาพแจ้งจนเป็นนิสัยในแอพ Tu pic now ได้มาภายในวันนี้ใช่ไหมคะ,แจ้งจบ/ขึ้นทะเบียนบัณฑิต
ซีเนียร์คะแจกที่ไหนคะอันนี้,ชำระเงิน/ใบเสร็จรับเงิน
ประวัติชีวิตคณะไม่กรอกไว้เลยครับ,ประวัตินักศึกษา
สวัสดรครับต้องการสอบเรื่องการชำระปลอบประโลมราคาภาคเรียนครับ,ชำระเงิน/ใบเสร็จรับเงิน
ตีพิมพ์ผิดครับ​ จะมาตรวจสอบผลการส่งเอกสารทางอิเล็กทรอนิกส์​,ขอเอกสาร/ใบรับรอง
ผมสามารถเข้าไปตอบรับตัวจริงรับหรือไม่คับ,ขอเอกสาร/ใบรับรอง
ตรวจสอบผลการขนถ่ายเอกสารทางไปรษณีย์,ขอเอกสาร/ใบรับรอง
ทางหอสมุดบอกว่าไม่ได้ค้างแล้ว แต่ทำไมสถานะค้างยังอยู่คะ,ชำระเงิน/ใบเสร็จรับเงิน
พอดีคุณพ่อนำไปถอนกับทางราชการแล้วเค้าแจ้งว่าให้สแต็มป์ด้วยค่ะ,ขอเอกสาร/ใบรับรอง
หลังชำระเงินแล้ว เอกสารส่งภายในกี่วันที่หรอคะ,ชำระเงิน/ใบเสร็จรับเงิน
ผมต้องการขอหนังสือรับรอง​คาดว่าจะจนเป็นนิสัยครับรหัสนักศึกษา​ หวย​ ,ขอเอกสาร/ใบรับรอง
กำหนดการจ่ายมูลค่าเทอม /,ชำระเงิน/ใบเสร็จรับเงิน
ภาพไปถ่ายจุดร้านแล้วสแกนส่งได้รับไหมคะ หรือต้องจากแอพเท่านั้น,แจ้งจบ/ขึ้นทะเบียนบัณฑิต
ต้องตีพิมพ์ใบแจ้งสิ้นสุดมั้ยคะ,แจ้งจบ/ขึ้นทะเบียนบัณฑิต
มันจะอัพเดตยี่สิบสี่ชั่วโมงไหนหรอมูลค่า,แจ้งจบ/ขึ้นทะเบียนบัณฑิต
การขอเทียบโอนผลคะเเนนรายวิชา(ระดับ),เกรด
ขอสลิปจ่ายที่ทำด้วยเงินใน tugreats ยังไงคับ กรณีเสียเป็น imstallment,ชำระเงิน/ใบเสร็จรับเงิน
สวัสดีค่ะเเจ้งทรงจนเป็นนิสัยไปเเล้วเเต่มันโทมัส_ยังงอกรออนุมัตินานมากเเล้วอะค่ะ,แจ้งจบ/ขึ้นทะเบียนบัณฑิต
ขออนุญาตซักไซ้หน่อยค่า รหัส เรื่องขอเอกสารจนเป็นนิสัยการศึกษา,แจ้งจบ/ขึ้นทะเบียนบัณฑิต
ขอได้ที่ไหนหรอคะ ในเวิล์ดไวด์เว็บไม่ขึ้นให้ยื่นขอเอกสารออนไลน์แล้วอ่ะค่ะ,ขอเอกสาร/ใบรับรอง
จะขอtranscriptค่ะ ,ขอเอกสาร/ใบรับรอง
ซีเนียร์คะทำไมถึงจ่ายค่าเทอมไม่ได้รับหรอคะ,ชำระเงิน/ใบเสร็จรับเงิน
มีมรรคไหนมั้ยคะ ที่จะขอประกาศนียบัตรวุฒิเก่าได้,ขอเอกสาร/ใบรับรอง
ทรงบัตรประจำตัวนักศึกษาออนไลน์ทรงไม่ขึ้นทำอย่างไรได้มาบ้างค่ะ,ประวัตินักศึกษา
เป็นนศรหัส ถ้าจะจนเป็นนิสัย3ชั้นกึ่ง ต้องแจ้งหยุดตอนไหนหรอคะ,แจ้งจบ/ขึ้นทะเบียนบัณฑิต
หรือสามารถดาวน์โหลดได้จากตรงไหนในเว็บ reg,ขอเอกสาร/ใบรับรอง
ฐานะอย่างนี้ซึ่งมีจิตปกติมั้ยครับ,สถานภาพนักศึกษา
กดยืนยันการจดทะเบียนไม่ได้,ลงทะเบียนเรียน
แบบนี้คือจ่ายสมัครงานรับมั้ยคะ,ขอเอกสาร/ใบรับรอง
รอดีกรีออกจากงานครบก่อน,เกรด
ต้องเสียเงินเพื่อให่ได้รับเอกสารด่วนแกน่ะเหรอคะ,ขอเอกสาร/ใบรับรอง
ชำระค่าเทอมไม่ทัน,ชำระเงิน/ใบเสร็จรับเงิน
สามารถติดต่อขอรับเอกสารอีกครั้งได้รับมั่ยคะ,ขอเอกสาร/ใบรับรอง
ในแอป Tu Great ก็ไม่เป็นเจ้าของมอบชำระเงินครับ,ชำระเงิน/ใบเสร็จรับเงิน
ดึงศาสตร์นั้นย้อนหลังได้ไหมคะ,ลงทะเบียนเรียน
สวัสดีค่ะ คะแนนเฉลี่ยของคณะนิติไม่ได้คิดเป็นgpaมอบให้หรอคะ,เกรด
พอดีเคยลงทะเบียนตั้งแต่คู่ที่แล้วละยังไม่ได้มาชำระเงิน,ชำระเงิน/ใบเสร็จรับเงิน
จะจ่ายที่ทำด้วยเงินขึ้นทะเบียนบัณฑิตแต่มันขึ้นแบบนี้ สร้างยังไงได้รับบ้างคะ,ชำระเงิน/ใบเสร็จรับเงิน
คือมันเป็น .XXX,เกรด
คือจะหาเอกสารคำร้อง แต่ว่าเข้าไปผิดไซต์อะค่ะ,ขอเอกสาร/ใบรับรอง
สอบถามสำนักทะเบียนครับ,ลงทะเบียนเรียน
การขอเทียบโอนผลคะเเนนรายวิชา(แต้ม),เกรด
วิชาจุดมีเหลือหายหมดเลย,ลงทะเบียนเรียน
จ่ายค่าเทอมไม่ทันกระทำยังไงหรอคะ,ชำระเงิน/ใบเสร็จรับเงิน
ผมขอไปยังเเค่ใบรับรองผลการศึกษา,ขอเอกสาร/ใบรับรอง
อันนี้คือขึ้นทะเบียนได้ถึงกลางวันไหนหรอคะ,แจ้งจบ/ขึ้นทะเบียนบัณฑิต
ช่งทำให้เพิ่ม-เบิกศาสตร์,ลงทะเบียนเรียน
ชนิดเซคจุดต้องการมันเต็ใแล้วอะค่ะ,ลงทะเบียนเรียน
แต่ตอนนี้ตรวจอย่างละเอียดแท่งโค้ดเรียบร้อยแล้วค่ะ,ชำระเงิน/ใบเสร็จรับเงิน
ถ้าขึ้นแบบนี้จะกดขึ้นทะเบียนบัณฑิตได้มามั้ยคะ,แจ้งจบ/ขึ้นทะเบียนบัณฑิต
ถ้าเป็นหน่วยกิตถอนได้คืนวิชาละ ทำให้เพิ่มชำระ เลยหรอครับ,ลงทะเบียนเรียน
ใบจนเป็นนิสัยจะได้รับช่วงไหนคะ,ขอเอกสาร/ใบรับรอง
อยู่ชั้น คณะsiit ถ้าจะลงเรียนsummerต้องสร้างยังไงคะ,ลงทะเบียนเรียน
นศแต่ละคนสถานะจะขึ้นไม่โดยพร้อมเพรียงกันหรอคะ,สถานภาพนักศึกษา
ถ้าเรารับเกรด acc,เกรด
แล้วขณะนี้หนูลงทะเบียนสำเร็จแล้วแต่ไม่บรรจุtuอะค่ะ,ลงทะเบียนเรียน
นักศึกษาชั้น  เปิดให้ทำให้เพิ่มเบิกรายวิชาอีกทีเมื่อไรหรอคะ,ลงทะเบียนเรียน
ซักไซ้เรื่องขอใบทรานสริปแบบออนไลน์ค่ะ,ขอเอกสาร/ใบรับรอง
อย่างน่าพอใจค่าา กราบขอบพระคุณอีกครั้งราคา,ขอเอกสาร/ใบรับรอง
ขอซักไซ้ครับ ถ้าต้องการขอประกาศนียบัตรยุติเป็นเจ้าของขั้นตอนยังไงบ้างครับ,ขอเอกสาร/ใบรับรอง
ตรวจสอบผลการส่งบอลเอกสารทางไปรษณีย์,ขอเอกสาร/ใบรับรอง
งอกสถานะลาออกแล้วครับ,สถานภาพนักศึกษา
ผมลืมชำระค่าปรับห้องสมุดครับ,ชำระเงิน/ใบเสร็จรับเงิน
ทำไมถอนศาสตร์ไม่ได้รับคะ,ลงทะเบียนเรียน
สวัสดรครับต้องการสอบเรื่องการชำระปลอบประโลมประโยชน์เทอมครับ,ชำระเงิน/ใบเสร็จรับเงิน
เพิ่งออกเงินไปเมื่อกี้ครับ,ชำระเงิน/ใบเสร็จรับเงิน
ติดต่อแล้วค่ะ ขอใบคำร้องปลอบประโลมได้ที่ไหนคะ,ขอเอกสาร/ใบรับรอง
ทีนี้ค่าทำให้เพิ่มหรือถอนทะเบียนผมครั้งรวมยอดคือ฿,ลงทะเบียนเรียน
สงสัยเพราะตีพิมพ์เรียนตัวนึงนอกคณะละมีนยังไม่เข้าระบบมั้งคะ,ลงทะเบียนเรียน
ใบบ่งชี้ผลการศึกษานี้เข้าไปขอได้ที่สนง.ทะเบียนรับเลบไหมครับ,ขอเอกสาร/ใบรับรอง
แต่ยังขอใบรับรองออนไลน์บวกไม่ได่ใช่มั้ยคะ,ขอเอกสาร/ใบรับรอง
อันนี้พึ่งจดใหม่เมื่อกี้เลยค่ะ,ลงทะเบียนเรียน
อย่างน่าพอใจค่ะ แล้วการจ่ายเงินช้าแบบนี้มีผลต่อการขึ้นทะเบียนบัณฑิตไหมคะ,ชำระเงิน/ใบเสร็จรับเงิน
จะมีการประกาศวัน ที่จะนำยื่นเอกสารวุฒิการศึกษารึยังคะ,ขอเอกสาร/ใบรับรอง
มีปุ่มเดียว ไม่มีปุ่มทำให้เพิ่มเบิกค่ะ,ลงทะเบียนเรียน
Section จุดต้องตีพิมพ์ติดตามตารางเรียนเต็มต้องผลิตอย่างไรคะ,ลงทะเบียนเรียน
ตอนนี้มองออกภาวะเป็นแบบนี้ ก็คือรอเอกสารใช่ไหมะ? ประมาณกี่ยี่สิบสี่ชั่วโมงค้า?,ขอเอกสาร/ใบรับรอง
และ3รถตรวจเช็คได้ยังไงคะ ว่าเรามีชื่ออาศัยในเซคนั้นแล้วจริงๆ,ลงทะเบียนเรียน
ค่าเทอมจุดจ่ายเกินนะครับก่อนที่จะป้ายโฆษณาลด,ชำระเงิน/ใบเสร็จรับเงิน
หาประจันหน้าเเล้วค่ะ ขนถ่ายเอกสารไปยังเป็นที่เรียบร้อยแล้ว,ขอเอกสาร/ใบรับรอง
แล้ววิชาจุดเปิดช่วงซัมเมอร์ สามารถตรวจสอบได้ที่ไหนคะ,ลงทะเบียนเรียน
ผมไม่สามารถตีพิมพ์ไปส่งเอกสารใมห่อักษรอีล้ารับครับ,ขอเอกสาร/ใบรับรอง
ต้องแจ้งยุติใน reg อีกทีไหมคะจุดนี้,แจ้งจบ/ขึ้นทะเบียนบัณฑิต
ขอรับใบปริญญาบัตรต้องติดต่อทางชีวิตไหนคะ,ขอเอกสาร/ใบรับรอง
ช่วงนี้น้องเรียนออนไลน์ค่าเทอมลดอนุญาตให้ไหมคะครู,ชำระเงิน/ใบเสร็จรับเงิน
ทางทหารผ่านศึกต้องใช้การรับรองจากทางมอค่ะ,ขอเอกสาร/ใบรับรอง
ขออนุญาตซักไซ้ค่ะ ลงทะเบียนภาคเรียน/ วันที่เท่าไหร่คะ,ลงทะเบียนเรียน
มีเหลือแต่วิชาจุดขอเพิ่มคือ el,ลงทะเบียนเรียน
และโทมัส_ยังลงทะเบียนไม่ได้,ลงทะเบียนเรียน
ค่าเทอมจะได้รับคืนภายในวันที่เท่าไหร่หรอคะ,ชำระเงิน/ใบเสร็จรับเงิน
คือเอกสารควรได้รับการอนุมัติภายในช่วงวันไหนเหรอคะ,ขอเอกสาร/ใบรับรอง
ทรงชุดครุยใช้งานไซส์กี่นิ้วมือครับ,แจ้งจบ/ขึ้นทะเบียนบัณฑิต
ต้องการซักไซ้ว่าถ้าต้องการถอนแล้วทำให้เพิ่มเป็นอีกวิชานึงได้มามั้ยคะ,ลงทะเบียนเรียน
ขอรับใบปริญญาบัตรต้องติดต่อการบินเครื่องร่อนไหนคะ,ขอเอกสาร/ใบรับรอง
นี้ก็คือสิ้นสุดเลยหรอคะ,แจ้งจบ/ขึ้นทะเบียนบัณฑิต
เปลี่ยนว่าหนูลงไม่ทัน,ลงทะเบียนเรียน
ทำชนิดผ่อนชำระไปยังค่ะ,ชำระเงิน/ใบเสร็จรับเงิน
จะมี  จุดกดได้ตั้งแต่วัน  แต่ขึ้นมาหน้าเพิ่มถอน,ลงทะเบียนเรียน
แจ้งจนเป็นนิสัยการศึกษา / ผ่านไปแล้วใช่มั้ยคะถ้ายังไม่ได้กล่าวต้องผลิตยังไงคะ,แจ้งจบ/ขึ้นทะเบียนบัณฑิต
ปุ่มขึ้นทะเบียนบันทิตไม่บรรจุงะคับ,แจ้งจบ/ขึ้นทะเบียนบัณฑิต
พอดีรุ่นน้องจุดขอไปพร้อมกันก็ยังรับแล้วเลยครับ,ขอเอกสาร/ใบรับรอง
แต่อันนี้เพิ่งตีพิมพ์เสร็จเมื่อเช้าไม่เล็งเห็นลดเลยค่ะ?,ชำระเงิน/ใบเสร็จรับเงิน
